_id,sid_comment,star,time,comment
,871,5,,(由 Google 提供翻譯) 忍者村好好玩，非常好玩忍者村好好玩，非常好玩忍者村好好玩，非常好玩忍者村好好玩，非常好玩忍者村好好玩，非常好玩忍者村好好玩，非常好玩忍者村好好玩，非常好玩忍者村好好玩，非常好玩忍者村好好玩，非常好玩忍者村好好玩，非常好玩忍者村好好玩，非常好玩忍者村好好玩，非常好玩忍者村好好玩，非常好玩忍者村好好玩，非常好玩忍者村好好玩，非常好玩忍者村好好玩，非常好玩忍者村好好玩，非常好玩忍者村好好玩，非常好玩忍者村好好玩，非常好玩忍者村好好玩，非常好玩忍者村好好玩，非常好玩忍者村好好玩，非常好玩忍者村好好玩，非常好玩忍者村好好玩，非常好玩忍者村好好玩，非常好玩忍者村好好玩，非常好玩忍者村好好玩，非常好玩忍者村好好玩，非常好玩忍者村好好玩，非常好玩忍者村好好玩，非常好玩忍者村好玩，非常好玩忍者村好好玩，非常好玩忍者村好好玩，非常好玩忍者村好好玩，非常好玩忍者村好好玩，非常好玩忍者村好好玩，非常好玩忍者村好好玩，非常好玩忍者村好好玩，非常好玩忍者村好好玩，非常好玩忍者村好好玩，非常好玩忍者村好好玩，非常好玩忍者村好好玩，非常好玩忍者村好好玩，非常好玩忍者村好好玩，非常好玩忍者村好好玩，非常好玩忍者村好好玩，非常好玩忍者村好好玩，非常好玩忍者村好好玩，非常好玩忍者村好好玩，非常好玩忍者村好好玩，非常好玩忍者村好好玩，非常好玩忍者村好好玩，非常好玩忍者村好好玩，非常好玩忍者村好好玩，非常好玩忍者村好好玩，非常好玩忍者村好好玩，非常好玩忍者村好好玩，非常好玩忍者村好好玩，非常好玩忍者村好好玩，非常好玩忍者村好好玩，非常好玩忍者村好好玩非常好玩忍者村好好玩，非常好玩忍者村好好玩，非常好玩忍者村好好玩，非常好玩忍者村好好玩，非常好玩忍者村好好玩，非常好玩忍者村好好玩，非常好玩忍者村好好玩，非常好玩忍者村好好玩，非常好玩忍者村好好玩，非常好玩忍者村好好玩，非常好玩忍者村好好玩，非常好玩忍者村好好玩，非常好玩忍者村好好玩，非常好玩忍者村好好玩，非常好玩忍者村好好玩，非常好玩忍者村好好玩，非常好玩忍者村好好玩，非常好玩忍者村好好玩，非常好玩忍者村好好玩，非常好玩忍者村好好玩，非常好玩忍者村好好玩，非常好玩忍者村好好玩，非常好玩忍者村好好玩，非常好玩忍者村好好玩，非常好玩忍者村好好玩，非常好玩忍者村好好玩，非常好玩忍者村好好玩，非常好玩忍者村好好玩，非常好玩忍者村好好玩，非常好玩忍者村好好玩，非常好玩忍者村好好玩，非常好玩忍者村好好玩，非常好玩忍者村好好玩，非常好玩忍者村好好玩，非常好玩忍者村好好玩，非常好玩(原始評論)忍者村好好玩，非常好玩忍者村好好玩，非常好玩忍者村好好玩，非常好玩忍者村好好玩，非常好玩忍者村好好玩，非常好玩忍者村好好玩，非常好玩忍者村好好玩，非常好玩忍者村好好玩，非常好玩忍者村好好玩，非常好玩忍者村好好玩，非常好玩忍者村好好玩，非常好玩忍者村好好玩，非常好玩忍者村好好玩，非常好玩忍者村好好玩，非常好玩忍者村好好玩，非常好玩忍者村好好玩，非常好玩忍者村好好玩，非常好玩忍者村好好玩，非常好玩忍者村好好玩，非常好玩忍者村好好玩，非常好玩忍者村好好玩，非常好玩忍者村好好玩，非常好玩忍者村好好玩，非常好玩忍者村好好玩，非常好玩忍者村好好玩，非常好玩忍者村好好玩，非常好玩忍者村好好玩，非常好玩忍者村好好玩，非常好玩忍者村好好玩，非常好玩忍者村好好玩，非常好玩忍者村好好玩，非常好玩忍者村好好玩，非常好玩忍者村好好玩，非常好玩忍者村好好玩，非常好玩忍者村好好玩，非常好玩忍者村好好玩，非常好玩忍者村好好玩，非常好玩忍者村好好玩，非常好玩忍者村好好玩，非常好玩忍者村好好玩，非常好玩忍者村好好玩，非常好玩忍者村好好玩，非常好玩忍者村好好玩，非常好玩忍者村好好玩，非常好玩忍者村好好玩，非常好玩忍者村好好玩，非常好玩忍者村好好玩，非常好玩忍者村好好玩，非常好玩忍者村好好玩，非常好玩忍者村好好玩，非常好玩忍者村好好玩，非常好玩忍者村好好玩，非常好玩忍者村好好玩，非常好玩忍者村好好玩，非常好玩忍者村好好玩，非常好玩忍者村好好玩，非常好玩忍者村好好玩，非常好玩忍者村好好玩，非常好玩忍者村好好玩，非常好玩忍者村好好玩，非常好玩忍者村好好玩，非常好玩忍者村好好玩，非常好玩忍者村好好玩，非常好玩忍者村好好玩，非常好玩忍者村好好玩，非常好玩忍者村好好玩，非常好玩忍者村好好玩，非常好玩忍者村好好玩，非常好玩忍者村好好玩，非常好玩忍者村好好玩，非常好玩忍者村好好玩，非常好玩忍者村好好玩，非常好玩忍者村好好玩，非常好玩忍者村好好玩，非常好玩忍者村好好玩，非常好玩忍者村好好玩，非常好玩忍者村好好玩，非常好玩忍者村好好玩，非常好玩忍者村好好玩，非常好玩忍者村好好玩，非常好玩忍者村好好玩，非常好玩忍者村好好玩，非常好玩忍者村好好玩，非常好玩忍者村好好玩，非常好玩忍者村好好玩，非常好玩忍者村好好玩，非常好玩忍者村好好玩，非常好玩忍者村好好玩，非常好玩忍者村好好玩，非常好玩忍者村好好玩，非常好玩忍者村好好玩，非常好玩忍者村好好玩，非常好玩忍者村好好玩，非常好玩忍者村好好玩，非常好玩忍者村好好玩，非常好玩忍者村好好玩，非常好玩
,872,5,,第872篇評論找不到，得用RAWDATA回溯
,873,4,,第873篇評論找不到，得用RAWDATA回溯
,874,5,,第874篇評論找不到，得用RAWDATA回溯
,875,5,,第875篇評論找不到，得用RAWDATA回溯
,876,5,,第876篇評論找不到，得用RAWDATA回溯
,877,5,,第877篇評論找不到，得用RAWDATA回溯
,878,5,,第878篇評論找不到，得用RAWDATA回溯
,879,5,,第879篇評論找不到，得用RAWDATA回溯
,880,5,,第880篇評論找不到，得用RAWDATA回溯
,881,4,,第881篇評論找不到，得用RAWDATA回溯
,882,5,,第882篇評論找不到，得用RAWDATA回溯
,883,5,,第883篇評論找不到，得用RAWDATA回溯
,884,5,,第884篇評論找不到，得用RAWDATA回溯
,885,5,,第885篇評論找不到，得用RAWDATA回溯
,886,5,,第886篇評論找不到，得用RAWDATA回溯
,887,5,,第887篇評論找不到，得用RAWDATA回溯
,888,5,,第888篇評論找不到，得用RAWDATA回溯
,889,5,,第889篇評論找不到，得用RAWDATA回溯
,890,5,,第890篇評論找不到，得用RAWDATA回溯
,891,5,,第891篇評論找不到，得用RAWDATA回溯
,892,3,,第892篇評論找不到，得用RAWDATA回溯
,893,5,,第893篇評論找不到，得用RAWDATA回溯
,894,5,,第894篇評論找不到，得用RAWDATA回溯
,895,5,,第895篇評論找不到，得用RAWDATA回溯
,896,5,,第896篇評論找不到，得用RAWDATA回溯
,897,5,,第897篇評論找不到，得用RAWDATA回溯
,898,3,,第898篇評論找不到，得用RAWDATA回溯
,899,5,,第899篇評論找不到，得用RAWDATA回溯
,900,5,,第900篇評論找不到，得用RAWDATA回溯
