_id,sid_comment,star,time,comment
,239,pos,7 個月前,購票就包含四種DIY活動，每個活動都很有趣，也都能將作品帶回家，簡單了解蠟筆及色筆的製作，很適合親子或情侶一起來玩。票根還能折抵產品100。
,240,pos,7 個月前,推荐男女老少值得來體驗的地方，特別建議可以讓師傅幫您彩繪，拍個美照。
,241,pos,5 個月前,活動很多，可以讓小孩學做蠟筆，彩色筆，和手作畫
,242,3,6 個月前,溜小孩不錯，但停留時間不會太長。較大的孩子或許會覺得無聊
,243,pos,6 個月前,"門票含四項DIY,還蠻不錯的，還再抵100元，很推薦喔。"
,244,pos,6 個月前,這個很適合帶小朋友來 蠻充實的 四個體驗手作才250還可以換一組蠟筆回家
,245,pos,4 個月前,"路過,隨興參觀可,帶小朋友來。"
,246,pos,7 個月前,250四種DIY活動，100溜滑梯，票價有點貴但還不錯。小孩要大一點，會自己動手做會比較好玩。
,247,pos,8 個月前,規劃的很不錯很有趣也新鮮內容都不難但也沒太挑戰性非常小朋友體驗只可惜彼此區域之間聲音干擾太大活動過程很背干擾影片、解說聲音要變很大使得講解時的關鍵要點沒接受到要透過服務人員的協助才完成門票可以底物品消費還不錯蠟筆類的選擇很多值得帶孩童玩耍
,248,pos,1 個月前,親子活動，可以玩很久
,249,3,7 個月前,DIY課程根本不夠時間給于實作。趕著去下一堂課，好讓下一波的人使用。250門票可折抵100算蠻佛心，自製產品單價都算便宜。
,250,pos,3 週前,壯觀外表，讚。
,251,pos,4 個月前,適合陪小朋友一起親子手作的地方...
,252,pos,1 個月前,要買蠟筆來這就對了
,253,pos,7 個月前,有四種DIY課程，每一種都超級有趣好玩👍門票250元贈送一個小蠟筆，還可以再紀念品折抵100元，非常划算呀！！
,254,3,11 個月前,之前來過宜蘭，印象中來過跟這個很像的做蠟筆工廠，所有流程，做法都很像，老公稱不同，但我認為是同一個老闆，不知道是不是正確。入門票大人$250，可抵$100，晚點說明怎麼抵消。小孩有分，我兒滿6歲也是$250，所以3個人噴了$750，好肉痛，最討厭到要自費門票的地方了。買了票，進入後第一關，是做扇子，這個跟之前不同有改良過，反正就是用蠟筆跟印泥畫扇子。第二關，做彩色筆，這跟之前一樣，但現在有電視教學，比較先進。第三關，做造型蠟筆圖案，反正就是拿碎蠟筆料，利用機器加壓製成，兒子玩的很開心。第四關，水彩人體彩繪，以前是有老師幫你畫，兒子還拍照，之前畫蜘蛛，現在要自己畫，我們沒天分，直接放棄，旁邊有一區，可以抵$100元小朋友換裝，或免費有些小小孩的造型服可以換穿，也有免費的假髮、皇冠、翅膀、刀、槍，之類的玩具可以讓你使用，旁邊還有星光大道，背景有海盜、森林、萬聖節造型，結束後就可以從出口出來。重點來了，我前面說過，可以抵消費，有很多蠟筆、彩色筆、人體彩繪彩妝，可以抵用，但～食物不行，我原本以為都可以，果然是想太多，只有產品，而且有的還只能抵用部份，價格上都有標示，我們有$300，所以有選擇性障礙的我，在哪裡選很久，彩色筆家裡有了，所以不換，還能換什麼，最後換了精靈寶可夢蠟筆，跟浴室水洗蠟筆，還自費買了一本塗鴉本，為了讓他可以乖乖，畢竟都買了蠟筆，沒東西畫也太慘了吧~事實證明這$50元花的最正確，每次都可以讓他安靜30～60分鐘，太好了～
,255,pos,7 個月前,園區很多活動，但是對於一家有三位孩子的家長而言，參加每項活動都是經濟負擔
,256,pos,8 個月前,大人小孩都可以同樂的好地方，門票250可以體驗4種DIY，有趣也富教育意義，可以耗一上午。真要說缺點的話就是DIY時間緊湊，但應該也是為了讓後方等候的家長不要排太久，整體來說蠻值得來一趟，這次去看樓上空間在改裝，期待下次來能有更多設施可以玩。
,257,pos,5 個月前,還不錯玩，建議孩子3歲以上再帶去
,258,pos,5 個月前,體驗活動還不錯，可惜沒玩到7層溜滑梯
,259,pos,7 個月前,好幾年前去過，大人小孩都很喜歡。今年去參觀後，看到環境變好價格也高一點是無所謂，但之前的親切服務已被人潮埋沒了，很懷念之前有點年紀卻很親切的服務人員。但還是值得去參觀的啦！
,260,3,7 個月前,門票有點貴，適合有小孩家庭參觀，情侶、一般成人家庭就不用考慮了……
,261,pos,7 個月前,蠟筆製作介紹清楚，四種DIY體驗簡單有趣，適合親子同樂，溜滑梯沒有體驗到，整體來說還不錯。
,262,pos,1 個月前,帶小小朋友來真的好玩
,263,pos,1 個月前,小孩的天堂，大人的地獄。
,264,pos,5 個月前,入園要門票，停車場廁所很髒。
,265,pos,7 個月前,路過 上廁所。天黑了 依然 因配色鮮明的建築而無法忽略。應是適合親子同樂的地方 有機會定會再來此處。
,266,pos,2 週前,小朋友可以來體驗。
,267,pos,7 個月前,還不錯的地點，很適合帶小朋友來的地點門票250元含4項diy還有100元抵消費還算合理
,268,pos,8 個月前,蜡藝蠟筆城堡(宜蘭蠟筆觀光工廠)位在宜蘭縣蘇澳鎮是非常適合親子同樂的宜蘭親子景點全室內的設施讓你就算下雨天也能盡情玩樂!!在蘇澳交流道附近巨大又鮮豔的蠟筆城堡外觀讓人遠遠就能注意到它有提供戶外免費停車場但假日建議要早點來!!
,269,pos,7 個月前,適合帶小朋友來走走晃晃的地方唯一需要在加強的是在購票的櫃檯的速度能在快一些嗎？全部的人都擠在買票處..
,270,pos,8 個月前,多年重遊 DIY 方式一樣，但還算保持水準，多了溜滑梯一定要玩，建議用餐區可以加強
,271,3,4 個月前,有趣，適合國小低及中年級孩子
,272,pos,7 個月前,人越來越多，一般門票就可以diy彩色筆，蠟筆，還有人體彩繪。真的是很豐富。
,273,pos,8 個月前,兒子來發揮想像力很開心。尤其是DIY的四種方式。算是消磨時間的好地方。平均停留約兩個小時左右（包含等待進場時間）一般票價250 （抵100元消費）可承租表演服或是購物區購買他們自家商品折抵。
,274,pos,5 個月前,到宜蘭兩日遊，很適合帶小朋友去
,275,pos,4 個月前,我只有路過拍照，裡面內容如何不要問我
,276,pos,6 個月前,1.停車場寬敞.2.服務親切.3.旁邊還有7-11.4.畫材多元、豐富。
,277,pos,4 個月前,這裡真是小朋友最好的寓教於樂的好地方
,278,pos,1 個月前,我覺得價位合理 內容充實
,279,pos,3 週前,外型特別，顯眼
,280,pos,7 個月前,買了票後，會有導覽場次，一路由專業的人員帶領講解，內容有自己做蠟筆、彩色筆⋯對親子同遊是很好的選擇！
,281,neg,4 個月前,除了適合小朋友作蠟筆，沒有其他用途
,282,pos,7 個月前,適合帶小朋友來製作蠟筆、彩色筆呦！讓孩子自己動手做會讓他們很有成就感呢！非常適合帶孩童來玩，闖關約半天的時間，其它晃晃一天就沒囉！
,283,pos,6 個月前,小朋友已經去過兩次。都還很喜歡 ，連國中生都喜歡
,284,pos,7 個月前,適合帶小朋友花一點時間去了解和體驗蠟筆跟色筆，也可以帶回一些自己的創作，有趣也算有意義!
,285,pos,7 個月前,假日帶小朋友體驗的好地方  有闖關活動又有小朋友愛的畫畫活動還有可以變裝拍照📷但是覺得價格偏高🤔折抵的金額不能用在點心上也有點可惜😔
,286,pos,6 個月前,親子DIY做彩色筆，兒童校外教學必去的地點之一。
,287,pos,1 個月前,帶小孩消磨時間的好地方
,288,pos,5 個月前,適合小朋友一同體驗，下次想體驗八層樓的溜滑梯
,289,pos,7 個月前,讓小孩認識蠟筆的生產過程，是專家們的心血及努力認真的態度所做出來的產品，要認真的對待手上的蠟筆，不要浪費了。
,290,pos,6 個月前,今天再度帶香港客人造訪……蠟筆城堡……。小朋友玩得很開心。
,291,pos,7 個月前,DIY課程不錯，時間稍嫌緊湊，但門票$250略貴，縣民優惠也僅平日適用
,292,pos,5 個月前,DIY製作超有趣，非常適合溜小孩
,293,pos,5 個月前,親子同樂的去處也讓小朋友了解製造過程
,294,pos,5 個月前,"交通,停車,吃,喝,均很方便，要方便也很方便，總之不錯啦。"
,295,pos,8 個月前,平均待在這時間約2個半小時一半票價250，可以抵用100元有四種DIY蠟筆跟彩色筆還有畫圖跟人體彩繪可以玩，有個小地方拍照，另外有溜滑梯，算是不錯的地點，帶小朋友來玩可以的
,296,pos,5 個月前,小孩DIY做蠟筆，不錯體驗教學，小孩很喜歡。
,297,pos,8 個月前,比較適合孩子的活動，本來以為可以看看工廠或是一些顏料的解說，買了門票進去才知道真的完全只有體驗活動喔，整體比較適合小孩大人想體驗童心也是可以，希望以後可以擴增更多知識性的展覽
,298,3,6 個月前,門票稍貴，帶小孩的較適合，對於沒帶小孩的，只看看就好
,299,pos,5 個月前,可以了解蠟筆製作過程，還有一個長長的溜滑梯可以玩
,300,neg,9 個月前,這次連假去，人真的太多，一看外面曬太陽排隊買票進場的隊伍快排到馬路上，就不想進去了，裡面的空氣因為人多，所以很差，每張桌子都坐著白般無聊等小朋友結束體驗的家長，我後來因為人多吵雜且diy看起來無聊所以放棄
,301,pos,8 個月前,還不錯的地方，裡面的設計色彩繽紛也很乾淨，大人小孩都喜歡。
,302,pos,5 個月前,外觀很可愛，可惜我沒有進去玩。
,303,pos,8 個月前,買票可以做很多DIY課程，印象深刻的是製作彩色筆跟造型蠟筆，靠近出口地方還可以玩人體彩繪跟變裝，非常有趣！
,304,pos,8 個月前,門票250，3歲以下沒收費，有四場DIY~可折抵100園內的商品，適合3～8歲小朋友！
,305,pos,2 週前,還行 外觀適合拍照
,306,pos,7 個月前,適合親子同行，Diy活動有趣又好好，能增加親子間的關係！
,307,pos,1 個月前,超高滑梯，值得試試
,308,pos,8 個月前,Diy行程小孩玩的很開心，唯獨時間稍嫌太趕一些，門票可折抵一百元CP值算蠻高的，有機會會在前往~
,309,pos,2 週前,有四個體驗課程
,310,pos,6 個月前,一個很適合小朋友的地方有很多可以趣味DIY的東西適合親子活動
,311,3,1 個月前,拍照是不錯費用有點高
,312,pos,5 個月前,務超所值的票價與遛小孩好地方
,313,pos,8 個月前,工廠裏裡四個教學遊戲很有趣，讓孩子知自己製作彩色筆和蠟筆的經驗很棒，門票可以折抵消費剛好又可以換了很多蠟筆回家，推薦可以去。周遭比較偏僻，如果有再多樣性整體規劃會更好
,314,3,2 週前,感覺比較適合親子活動
,315,pos,1 個月前,好玩，可以解壓！
,316,3,4 個月前,因要收費，未了解太多
,317,pos,8 個月前,我看過一個小丑，會把插在桌上的筆變不見，不知道這裡有沒有這種show？
,318,pos,9 個月前,拔拔麻麻們可以帶小孩來做勞作，還有可以作些自己創作的蠟筆，入口處可以購買些小朋友的創作書可以買回去自己畫，還有很多蠟筆可以購買，最重要的是這裡建築物的外觀真的做的很吸引人小朋友很喜歡旁邊的7-11也是一樣小城堡的外觀來的人記得拍照留戀一下，如要待一整個下午不太可能所以也建議搭配附近的景點一起逛逛到處走走！
,319,pos,5 個月前,門票偏貴，孩童多，有點吵雜
,320,pos,7 個月前,小朋友們都很開心的玩唷～兼具教育與遊樂的好地方
,321,3,8 個月前,65歲以上不用門票，門票250元一張，關卡分四個部分，約需Diy停留時間約90分鐘，門票一張可抵購物金100，PM16:30最後入場時間以上……給予參考。
,322,3,7 個月前,DIY的器具沒有整理，製作的筆頭馬上被其他顏色墨水染黑，看到滿難受的
,323,3,7 個月前,適合親子活動單純大人團遊不建議裡面有一個很棒的彩虹溜滑梯有小孩會很適合去
,324,3,7 個月前,"門票價格偏高, DIY 種類變化不多, 適合待2-3小時"
,325,pos,4 個月前,門票可抵購物，很經濟實惠
,326,3,6 個月前,無毒無害蠟筆，買給小孩用安心。☺
,327,pos,8 個月前,讓大家了解蠟筆彩色筆等商品製作過程，有寓教於樂的行程
,328,neg,7 個月前,工作人員的態度不佳，沒笑臉就算了，對於小朋友不友善
,329,pos,5 個月前,體驗手作都不錯，很好玩👍
,330,pos,9 個月前,"小而巧的觀光工廠，一張門票可以作4種DIY,門票還可以抵100元消費，進場時間會有管制，流程安排的很好，約2-1.5小時小孩可以玩的很開心"
,331,pos,5 個月前,小朋友玩的很開心，很棒的體驗～
,332,pos,8 個月前,Diy 活動多，不過入場通通要買票，不見得不好，但陪小孩進去也要買，總是花費就多了…
,333,pos,9 個月前,基本上 我覺得觀光工廠就是要有DIY課程 蜡藝城堡裡面的DIY課程 讓我們小孩獲得很多知識體驗 我覺得很值得 3歲以上孩子就收門票250元 但是可以做4關DIY 其實很豐富 但是 時間停留要2個小時 建議吃飽飯後去 或是 要早點到 更能夠好好體驗課程喔
,334,3,9 個月前,我覺得少了一點什麼？或許是商業觀光導向行程一批批的群組模式(行程有幾個介紹站點只能向前，一團團向前移動)，並不能針對特感興趣的項目多做停留，有點可惜。
,335,pos,6 個月前,很棒的一間親子觀光工廠，宜蘭蘇澳的蠟筆工廠
,336,pos,4 個月前,不錯，是帶小朋友來的好地方
,337,pos,8 個月前,門票250元，可抵商品100元，還有4項體驗。
,338,pos,7 個月前,有趣且超值，很適合親子一起來體驗遊玩。
,339,pos,9 個月前,地方很大，主要是DIY的親子行程，所以年紀太小的話（2.5歲以下）可能就是去逛逛而已，也沒什麼吃的東西，這部分可以再改進會更吸引人潮！
,340,pos,5 個月前,門票有點貴!但是可做diy四種東西
,341,3,5 個月前,沒有小朋友的話，來這兒沒什麼可玩喲
,342,pos,5 個月前,門票確實貴了點！是小朋友體驗活動！
,343,pos,8 個月前,適合親子旅遊，可以增長見聞，還有一些DIY，基本上小孩大人都可玩得開心，門票還可抵消費100元
,344,pos,8 個月前,適合大小孩去玩的地方，太小的孩子會受不了，門票折抵裡面的製作過程教學，這點不錯，雖然裡面沒什麼特別之處，但最後的彩繪變裝活動應該可以讓小孩徹底放電，變裝造型是要另外收費這點要注意
,345,pos,6 個月前,可能有國小以下小朋友的家庭較適合吧
,346,3,7 個月前,兒童色彩親子體驗，遺憾沒看見現場製造過程
,347,pos,7 個月前,小孩很喜歡，可以做蠟筆帶回家，也可以畫人體彩繪，很有趣
,348,pos,8 個月前,小孩玩得很開心，門票250四項DIY，最後還可以商品折抵100，算超值的
,349,pos,8 個月前,從西岸到東岸，為此已經來不止一次，還要我說啥！！
,350,pos,5 個月前,DIY體驗很有趣，很適合親子一起來
,351,pos,8 個月前,假日人潮雖多，每場次人客數控管恰當，每場DIY都一定做的到，小朋友都玩的很開心
,352,pos,5 個月前,帶小孩殺時間的好地方，門票200多
,353,pos,8 個月前,很適合帶小孩來可以做蠟筆、彩色筆課程豐富有趣非常推薦👍
,354,3,9 個月前,就門票而言價格不夠親民就服務來看，勉強合格就課程來說，只有二個是真正的DIY整體評價：來一次就可以了
,355,3,7 個月前,有體驗課程，適合國小以上學生，太小不適合。
,356,pos,8 個月前,確實是遛小孩的好地方，門票也能抵部分商品，就是體驗的有點趕，但是小孩還是玩得很開心
,357,3,9 個月前,若在礁溪、宜蘭、羅東、蘇澳..附近遊玩，突然有2~3小時空檔不知去哪兒..這裡是帶著小朋友很好消磨時間的地點..
,358,pos,4 個月前,DIY很好玩，但門票有點貴
,359,neg,11 個月前,我的小朋友8/10，在参加diy 課程因爲身體不舒服而嘔吐，現場連一位工作人員也沒來協助和關心，甚至連一個耳溫槍也商借不到，工作人員ㄧ副事不關己的心態，讓身為家長的我感到非常憤怒！萬一發生事故，家長就只能自求多福嗎？？？所以我完全不想再跟親朋好友推薦。
,360,3,7 個月前,這裡合適親子活動 裡面有很多小朋友玩的配套措施
,361,pos,4 個月前,帶小孩來玩很開心，好玩
,362,pos,9 個月前,全館環境與服務都不錯唯獨結帳時遇到發票給錯問題，沒有立即檢視是我們的問題，但馬上回櫃檯爭執了一下子才願意補開給我們。
,363,pos,9 個月前,算好玩又有跟小孩互動的親子場所 不過設施過少 教學製作DIY 可以在多一些選擇會更棒裡面餐食建議多一些
,364,pos,9 個月前,1個導覽4個DIY，大人小孩都好玩，門票抵100購物，太佛心了
,365,pos,9 個月前,門票一人250，有四項體驗，可以自己做彩色筆跟蠟筆，門票還可以抵商品，帶小孩來玩非常的超值喔！
,366,pos,5 個月前,環境還不錯，但收費有點高
,367,pos,1 個月前,帶小朋友可以玩一天
,368,pos,3 個月前,小孩很喜歡DIY課程喔！
,369,pos,7 個月前,不太適合3歲以下的小小孩，門票偏貴
,370,pos,9 個月前,DIY部份挺不錯的：） 大人小孩都玩的開心建議抵用券的部份不要花在讓小孩變裝（衣服都已經破舊了⋯）不如在外面買一盒蠟筆比較實在
,371,pos,7 個月前,經過，很漂亮。不知道菸味很臭嗎
,372,pos,9 個月前,適合3歲以上(或會走路聽得懂人話的)小朋友來玩，DIY活動很多，帶回不少紀念品，門票可抵部分消費，算是很有誠意的觀光工廠
,373,pos,9 個月前,活動安排很順，品質還不錯，門票可抵消費，所以又買了一些彩色筆跟蠟筆回家，小孩玩的很開心
,374,3,11 個月前,雖然門票貴，但得到的東西物超所值，不過很不喜歡整個課程品質，也許是遊客多，整個課程流動程序像菜市場，應該想一個措施因應，不然我看到好幾位媽媽或阿公、阿嬤獨自帶小孩來的，沒有幫手，排隊、座位都在後面，沒辦法聽清楚流程做法，操作也是排隊到最後，小孩和大人沒辦法盡情、盡興，只覺得像趕鴨子一樣，一場一場的換教室，再來，門票可折抵100元商品，但又限制可購買的商品，挑的很累，算得很累，指標性的觀光工廠，應該再大器一點。
,375,pos,5 個月前,活動很有趣，富有教育意義。
,376,pos,8 個月前,很適合溜小孩全票含四樣DIY體驗可以跟小孩親子互動門票可合併折抵消費
,377,pos,6 個月前,門票可以玩DIY.還可以折抵100元
,378,pos,10 個月前,"以前是小朋友買,然後大人陪同製作...但現在是小朋友要進去..大人也一定要買...所以感覺又更燒錢了....但做下來大概要2個小時且環境也挺乾淨的....所以CP值就見人見智了"
,379,pos,9 個月前,包套行程蠻有趣的，不過可能因為假日大雨，大家都躲來這，人多器材不夠使用，導致每個活動都很緊湊，有時候導覽人員還會趕人....
,380,pos,9 個月前,大人250，未超過三歲小孩免費。門票可折扣100元商品，要玩溜滑梯配合門票要多收60。整體而言還不錯，有繪畫，製作彩色筆，蠟筆，人體彩繪等四項DIY課程，小孩玩的很開心。但是入場到出場，都是錢錢錢，跟台北的感覺太像了，等於一個小孩體驗價就是三張門票錢，口袋要自己斟酌。
,381,pos,9 個月前,用心經營的觀光場所，票價雖然有些貴，但體驗過後物超所值，整體規畫動線清楚明瞭，均有工作人員帶領，共有4種DIY可體驗，部分門票亦可折抵購物金，大人小孩都適合的好地點。
,382,pos,8 個月前,孩子玩得開心美中不足的是每場給的創作時間有點趕.....
,383,pos,10 個月前,如果小朋友喜歡畫畫這是好地方，門票抵消費而且手作的東西都不錯玩尤其是自己做形狀的蠟筆，還有一個很高的溜滑梯（另外購票），離交流很近如天氣太熱或是下雨天不知道去哪可以去走走。不過除了商品銷售區外，都是需要買門票的（可以低消費，蠟筆商品很多原也差不多都是蠟筆的商品）
,384,pos,6 個月前,小家庭假日讓小朋友學習的好地方，推推
,385,pos,9 個月前,"一人250可DIY四種蠟筆產品體驗,小朋友好玩,每張票還換100元等值商品,滿有趣的"
,386,neg,9 個月前,爛透了，排隊排很久買DIY體驗，實際上根本沒什特別的，就是騙小小孩進去玩而已
,387,pos,8 個月前,適合帶小朋友去看看玩玩，裡面有個超大型的溜滑梯，但費用有些貴
,388,pos,8 個月前,很有心的觀光工廠，亮麗光彩，而且提供Diy讓全家人同歡
,389,pos,3 個月前,體驗教學用心、親切。
,390,pos,9 個月前,一個人250元，其中100元可抵換商品。4個DIY都簡易好上手，適合中低年級以下小孩。
,391,pos,9 個月前,DIY四個關卡，小朋友可以盡情參與且安全無虞。超長溜滑梯經過精心設計孩子們說很超值~
,392,3,10 個月前,"觀光工廠的幾個重要元素都有具備 ，8/14親自帶我的女兒參觀 ，DIY過程  我個人覺得希望在每個個別程序中能夠讓參加的來賓多一點自己的自由時間去真正的去體驗了解每個製造過程 ，而不是蜻蜓點水式的草草結束,不過整體對小孩來說是值得參觀的點"
,393,pos,9 個月前,門票裡面有不少手作課程，好玩又印象深刻，很適合親子和三五好友拍照遊玩，手做體驗自己做彩色筆和蠟筆很有趣，大推😄
,394,pos,11 個月前,門票雖然250元但CP值超高，買完票直接送蠟筆鎖匙圈，進場有4個體驗活動(彩繪扇 彩色筆製作 DIY壓模製造蠟塊 身體彩繪)，入場最後是主題拍照區；剩下的票可以扺100購買他們的產品.......當然都是蠟筆相關；有超高溜滑梯很好玩，但要另付費才可以體驗
,395,3,7 個月前,其實最後一個入場次 好享有點在趕行程一樣
,396,pos,9 個月前,還不錯的體驗工廠～雖然票被撿走冒用！但不失玩樂的興致
,397,pos,9 個月前,"進入蘇花公路前的一個景點 , 有帶小孩應該非常好溜達 , 門票可抵消費 !旁邊的7-11裡面也用蠟筆畫的OPEN小醬 , 讚 !"
,398,pos,6 個月前,很有趣！四個活動都一定要參加！
,399,3,9 個月前,還可以，如果只是觀光不花錢不適合來。進去消費每人低消套裝行程就要200起跳了。
,400,3,9 個月前,人多的時候等起來的時候很可怕，男生廁所的設計隨然有特色但尿尿時水會噴出來，跟舊館比起來大了不少，建議離峰時段再過去
,401,pos,9 個月前,這個地方適合帶小朋友一起來，總共可以打發最少2小時(票可以換東西，所以其實很划算)
,402,pos,9 個月前,門票250$$ 但包含手作的活動哦，做完還可以在裡面買東西折100，是不是真的很佛心，而且教學的老師都很專業，很適合跟另一半還有家人帶著小朋友來體驗看看
,403,3,6 個月前,收費有點太高，diy課程很趕
,404,pos,11 個月前,從五號高速公路一下到末端蘇澳交流道，遠遠就可以看見蠟筆造型的大建築物，足以讓大人、小孩驚呼～進入需要門票，不過會贈送縮小版蠟筆組，現場還有三道關卡可體驗互動，像是蠟筆造型壓印、彩色筆製作及身體彩繪，顏料及材料本身都是非常安全的，爸媽可以很放心一起參與，門票也可抵用於商品購買，整體來說非常划算，又能帶走滿滿回憶與紀念品。
,405,pos,7 個月前,很適合孩子，非常棒，還有畫人體彩繪的蠟筆，值得購入
,406,pos,9 個月前,四階段的diy，門票250可以抵100消費，消耗2個小時沒啥問題，我覺得不錯。
,407,pos,9 個月前,超適合全家大小一起來😍如果沒有小朋友，一群朋友來體驗也是很逗趣的🤣可以一起舉辦繪圖大賽，笑到不行😀
,408,pos,6 個月前,有DIY活動，需付費使用的。
,409,pos,9 個月前,宜蘭蠟筆城堡-有條理的介紹，DIY動線，活動時間安排，控制得宜。很棒～真是一個快速消磨時光的好地方。門票250，可以DIY 3種活動，買販賣部商品門票又能抵扣100，真心推薦。
,410,pos,5 個月前,建築物很特別，可以來踩點
,411,pos,10 個月前,蠟筆外型的建築很特別，但比較適合幼稚園以上的小朋友來玩，入場有分時段批次的，所以不用擔心一窩蜂人都擠在一起，體驗製作彩色筆及蠟筆的過程很有趣，場外也有用餐區可以休息，課程內容建議可以再豐富一點，不然動作快的很容易沒事做就開始發呆了。
,412,pos,10 個月前,"門票250元，可抵自家商品100元，其實是溜小孩的打發時間好地方，門票包含了4種DIY,這次做了扇子彩繪、3隻彩色筆、1塊愛心的"
