_id,sid_comment,star,time,comment
,413,pos,9 個月前,這裡是親子互動的好地方，裡面有蠟筆製作，也可以購買及遊戲區，小孩子很喜歡來這裡，有停車場，旁邊的7-11造型也很特別，在這裡待上半天也值得，裡面有些設備需付費，但是值得去購買
,414,pos,9 個月前,親子玩樂好去處，下次還會再去。只是回台北的時間盡量避開交管時間。
,415,neg,8 個月前,門票有點貴，雖然可以折抵消費比較適合帶小朋友來
,416,pos,9 個月前,有親身體驗玩蠟筆的地方，要進去體驗及遊玩，要繳交500元（人），前門是拍照的好去處。
,417,pos,10 個月前,超值門票，享受豐富DIY。別於以往的觀光工廠強力推銷品牌，讓人在體驗過程中開心的學習，趣味十足。不只小朋友開心，大人也玩的快樂。
,418,pos,1 年前,原來蠟筆工廠的新腹地，原本第一關DIY的著色紙，換成紙風車製作，原本蘇澳風就不小，看著剛做好的紙風車一直不停的轉呀轉，小朋友成就感滿滿！新蠟筆城堡還多了另外三種專業的DIY，費用另計，但送得禮物都很棒，根本就是買文具送服務，相當划算！推薦給所有學齡前中的小朋友家庭。停車和廁所都沒有問題，除了本身有供餐點外，對街兩間的7-11像是專門為此設點的，唯一讓我們感覺遺憾的是，像我們這樣來四次以上的老主顧，家長進去還是要跟孩子一樣買全票，或許可以增加一種家長陪同票，讓我們更樂意帶小朋友前來！
,419,pos,8 個月前,好玩，票價還能折商品，小孩玩的很開心
,420,pos,9 個月前,適合帶小孩來體驗👍很棒。大人、小孩都開♥
,421,pos,9 個月前,外型明顯好找，價錢公道，適合帶國小2年級以下去
,422,pos,10 個月前,新蓋好的蠟筆城堡帶小朋友來非常有趣~與舊館不同的是一票到底~也就是說買好門票等成團後會一起走完所有diy課程~時間上得配合課程，對於行程較多的旅客，安排可能需要多點時間~
,423,pos,9 個月前,可以自己diy彩色筆、蠟筆，小孩每次到宜蘭玩，一定指定要來蠟藝玩。
,424,pos,5 個月前,有很多體驗 很棒 做出來的蠟筆很可愛
,425,pos,8 個月前,大人不喜歡畫畫怎麼辦？希望可以開放畫小朋友。
,426,pos,9 個月前,孩子能親手製作蠟筆、彩色筆，獲得成就感也能體驗海綿繪畫，很有趣
,427,pos,1 週前,帶小朋友來不錯
,428,pos,9 個月前,很適合遛小孩的地方，體驗活動很有趣，可以增加很多知識。
,429,pos,1 週前,小朋友放電的好地方
,430,pos,10 個月前,門票$250內含100元可購物折抵商品費，活動有四項體驗，皆有限時10-15分鐘左右，總停留時間不超過二小時，因為時間緊湊所以不無聊。
,431,pos,10 個月前,非常推薦親子同遊地點！交通方便又好停車～本來以為是個空虛的點～殊不知手作導覽行程安排得非常好！一家大小都玩得很開心！
,432,3,6 個月前,沒錢進去qq外面拍照也不錯喔
,433,pos,10 個月前,是知性，手作，休憩等多面向的景點，值得一逛，對面有7-11超方便。
,434,pos,10 個月前,有4項手做活動，還有8樓高的溜滑梯，很適合帶小朋友來親子活動。
,435,3,7 個月前,三歲以上才能玩。假日真的不要去
,436,pos,10 個月前,非常適合親子同遊的手作館，完全值回票價，我們兩大一小玩的很開心  
,437,3,10 個月前,小朋友畫畫的天地。買了一盒人體彩繪蠟筆，筆值偏軟偏粗不太適合彩繪臉部
,438,3,10 個月前,幼小學生很適合，年級太高會覺得無趣..要不然.門票是貴了..
,439,neg,10 個月前,很開心的帶著朋友及家人來玩，沒想到售票小姐的態度超級不好。講解的姐姐也沒親和力。一點都不親切，這裡讓我不會再想來第二次，也不建議大家來這裏花錢受氣。有夠爛。
,440,pos,1 年前,門票1人250元，兩大兩小就1000了（但不能刷卡QQ) DIY體驗很好玩，小朋友玩得很開心，非常值得推薦，店家已經配合國稅局開立電子發票刷載具，但唯一缺點就是不能刷卡只收現金！建議儘速導入行動支付（LINEPAY 、街口支付、Applepay等）結帳，多元支付是未來趨勢。加油！
,441,pos,1 個月前,帶小朋友出去的好地方
,442,pos,5 個月前,適合親子前來 門票有小貴
,443,pos,10 個月前,很適合帶小朋友來參加，玩完後可以到對面吃烤雞
,444,pos,10 個月前,有四關diy體驗，假日人很多早點來，一批批團體放進去的不能單獨行動，整體來說蠻具教育意義的很有趣，去的時候剛好溜滑梯沒開放
,445,pos,7 個月前,"有小小孩的話,不錯玩！"
,446,pos,9 個月前,親子DIY的好地方門票可全額折抵滿多商品，還不錯
,447,pos,10 個月前,DIY製作心型蠟筆，小朋友玩的很開心，門票能抵部分商品相當不錯，適合全家大小。
,448,pos,1 個月前,門票250其實超超質
,449,pos,10 個月前,三年前來過，那時候裝潢好陽春，這次再來內容一樣，不過環境變得相當明亮。小朋友完全忘記曾經來過
,450,pos,10 個月前,進去沒買票(大人也需要買票)只能在大廳逛逛~不適合單純來逛的人~適合想DIY的人
,451,pos,10 個月前,真的太酷了！可以讓孩子DIY享受成就感，和彩色筆蠟筆的製作過程重點是還有小禮物喔！大人小孩都不會無聊
,452,pos,10 個月前,帶小孩來這邊DIY很有趣，自製彩色筆、蠟筆，從玩樂中學習，還有DIY彩繪加cosplay，小孩玩得很開心
,453,pos,3 個月前,小孩玩得很盡興！
,454,pos,9 個月前,小孩玩到不易樂乎，做出來的東西還可以帶走，還不錯！
,455,pos,10 個月前,小朋友想玩溜滑梯但會怕，工作人員還是很親切的幫忙安撫小孩👍小孩挑戰成功👍
,456,pos,10 個月前,有次序的進場，空間也變得更大，可惜最後彩繪的部分時間有點太短了，有點可惜!
,457,pos,10 個月前,絕對值得專程造訪，這兒還有好玩的溜滑梯，這次遇颱風天沒有開放，期待下次再來玩 😍
,458,pos,8 個月前,外觀顏色很鮮豔，與隔壁7-11相輝映
,459,pos,1 年前,很不錯的觀光工廠一般門票可以做4種DIY也可以抵100元消費新的彩虹滑梯目前7樓在整理餐廳所以要8月才會開放(官網不確定有沒有公告沒玩到好可惜
,460,neg,10 個月前,平日來入場也是等超久，看著團體一團一團瞬間入場，把散客當笨蛋，真的很有時間的才來。
,461,pos,4 個月前,很棒大人小孩都喜歡逛啊
,462,pos,10 個月前,門票不算便宜，但有手作還可以抵消費，算還行，雨天可以來的景點
,463,pos,10 個月前,親子活動豐富好玩，也對蠟筆彩色筆有更近一步認識，寓教於樂的好去處
,464,pos,11 個月前,育教於樂的好地方，雖然入園費有點貴，每人250元 ，但入園後有4項教學體驗，可和親子邊玩邊學作扇子，彩色水筆，爉筆，人體彩繪等，是一種不錯的體驗。
,465,pos,5 個月前,適合大人小孩來玩的親子活動場所
,466,pos,2 週前,適合帶小朋友體驗哦
,467,pos,10 個月前,裡面還蠻有趣的，不過好像都是針對小孩的遊戲比較多，如果有大人也可以參與的遊戲就更好了
,468,pos,9 個月前,好玩有趣帶小朋友殺時間的好地方手作品很實用推薦
,469,pos,10 個月前,"非常適合帶小朋友,一起用小孩動手作,很有特色有趣又好玩，一個非常合適的半天行程景點!"
,470,pos,9 個月前,門票可抵消費，四樣手作品也很有趣
,471,pos,9 個月前,小朋友會很喜歡，因為有手作體驗課程，還不錯哦！
,472,pos,10 個月前,很適合5歲以上的小朋友來了解彩色筆的製造過程，門票包含了四項 DIY項目，小朋友應該可以玩的很開心
,473,pos,10 個月前,很值得在去，250門票，玩四關，還去抵用100，小朋友做的開心，大人也開心
,474,pos,10 個月前,往宜蘭的大地標門口停車位一位難求啊XD大家都想停門口拍照進去裡面的門票稍貴可能要帶小孩去才比較會想進去
,475,pos,11 個月前,由商家規劃的diy流程，但大多小孩都坐不住，一整個下來多二個半小時左右，小孩都蠻開心的，後面有扮裝的，要花一張票(等於100元)，出口處可以用票換等價蠟筆，水彩等用具。
,476,pos,4 個月前,小朋友發揮創意DIY的觀光工廠！
,477,pos,5 個月前,好地方 門票抵消費 蠟筆超便宜
,478,pos,9 個月前,八層樓溜滑梯、蠟筆販賣部，很適合帶小孩來玩！
,479,pos,9 個月前,非常適合小小孩來玩❤250一個人覺得很值得
,480,pos,3 個月前,小孩可以體驗臉部彩繪
,481,pos,5 個月前,裡面的彩虹溜滑梯超好玩😄
,482,pos,11 個月前,很好玩，而且全室內活動，夏天也不用擔心太熱，小朋友自己DIY做了好多戰利品帶回家，都玩的很開心，一直說下次還要再去玩！👍
,483,3,9 個月前,3歲以上入場門票250含4項diy及100元抵腊藝產品
,484,pos,10 個月前,溜小孩的好地方，兒童票若是能在優惠會更好。
,485,pos,10 個月前,真的是孩子的王國，在這裡可以溜小孩一個早上的時間😅除了DIY創作，還可以加購彩虹溜滑梯，真的很好玩唷～
,486,pos,10 個月前,很適合小朋友體驗和diy，需要門票和體驗費用，商品區普通，有食物飲料可以購買，停車區算大
,487,pos,10 個月前,蠟筆的DIY活動相當多元又精彩。還有專屬的7-11很酷，休憩很舒適。
,488,pos,3 週前,很棒的親子活動
,489,pos,8 個月前,可以跟小孩一起做蠟筆，不錯玩喔
,490,neg,1 年前,很差的經驗，一顆星都不想給…門票和綠色博覽放桌上，換位子時忘記順手拿就馬上被撿走，雖然問櫃臺每張門票可抵用100元只要還沒被使用記錄就可以趕快先買東西抵用，但在購物櫃臺查詢時竟然已被使用！！！去售票櫃臺建議抵用前要有防範措施(如確認發票之類的)，因為這算是有價票券被侵佔使用，竟然只說他是員工只能往上建議，之前也有人有同樣情況且報警處理了，但不知後續處理結果，表示 貴公司不注重顧客權益沒有改善對策！
,491,pos,11 個月前,新大樓比較有特色，而且追加了八層樓高的溜滑梯，但要付點費用，需要套布套也有護腕套有管控，不錯。
,492,3,5 個月前,較適合國小以下的小朋友。
,493,pos,7 個月前,還不錯可以逛逛的點，小朋友很愛
,494,pos,1 年前,適合一家大小一同體驗半天的環境，，順帶了解色筆的生產過程，並可帶回四項DIY產品(手繪風車，色筆DIY，城堡蠟筆壓制和人體彩繪體驗)。位於宜蘭新馬車站旁，出站後步行10分鐘可到達，購買一日體驗券後會有專人導覽，說明色筆成分，和製作流程，完畢後開始DIY體驗；過程中總共分為四關，首關為手繪風車，可透過水性顏料手繪設計自己的風車；次關為色筆DIY，有6種顏色可供選擇製作，從筆頭壓制，筆芯加水到完整封裝，可讓大人小孩完整了解色筆的製作過程，原料強調無毒可安心使用；再來是透過模具壓制城堡造型蠟筆，過程安全簡單，成品可愛有特色；最後為手繪體驗，是個殺底片的好地方，有美麗佈景和服裝租借(免費 & 付費可用門票抵用)，最後出來有用餐區和紀念品區。整體過程花費約半天，適合一家大小同樂，輕鬆又安全。
,495,pos,6 個月前,開館前就到 好停車又好玩
,496,pos,5 個月前,活動很有趣。也滿豐富的
,497,pos,9 個月前,8層樓高的溜滑梯超酷!4場活動設計得宜
,498,neg,11 個月前,先前來一次，覺得很棒，二訪後發現有負評絕對給零分，非常令人失望，根本是來菜市場做DIY，散客跟不上就被丟包，越做越囂張，要來最好三思。。。。工廠越大，素質越差
,499,pos,10 個月前,親子同樂很適合，但是要會一起互動，有基本的認知，玩起來會更好玩
,500,pos,11 個月前,$250元的DIY課程，可以做1個扇子、1個蠟的小飾品、3支彩色筆及人體彩繪（右手畫在左手上），門票還可抵100的消費。不錯。
,501,pos,11 個月前,是一個適合帶小朋友遊玩的地方！門票包含四個DIY活動，又送一個小蠟筆鑰匙圈，購買蠟筆等，還可以抵100元哦！！實在很划算哦！
,502,pos,10 個月前,光看城堡的外型就會想進來看看， 有說明蠟筆的歷史和販賣許多造型蠟筆， 可帶小孩來長知識！
,503,pos,10 個月前,蘇花前的大休息點，好停車，可以讓小朋友參與蠟筆的製作過程，也能將作品帶回
,504,pos,10 個月前,一大早帶小朋友來玩不用人擠人，小孩很開心也覺得好玩！尤其做彩色筆很有趣。
,505,pos,4 個月前,讓小朋友玩樂的好地方。
,506,pos,9 個月前,這裡有一系列的DIY課程，適合帶小朋友來玩
,507,3,11 個月前,說實話，只有小孩比較喜愛，賣的產品選擇性真的很少，實用性.....不太好。但是環境衛生還不錯，停車也方便。
,508,pos,10 個月前,很適合小朋友來玩，玩累了，還有炸物拼盤可以買。
,509,pos,11 個月前,第一次造訪這裡，是親子旅遊的好地方，可以讓小孩子了解腊筆的由來及親自製作的過程~讓小孩還沒離開就說下次還要再來~😍
,510,pos,10 個月前,好玩划算，值得過陣子再帶小孩來一次，門票250抵消費100
,511,neg,5 個月前,蠟筆廠已經關門、沒有了。
,512,neg,10 個月前,不是不好，只是覺得很粗糙，有需要是真正要以台灣人出發服務為基本才是
,513,pos,8 個月前,讓小孩體驗DIY的好地方，推！
,514,pos,10 個月前,有玩有拿 ，入場就有小禮物 ，而且門票還能抵100元的消費 ，是個遛小孩的好地方
,515,3,1 年前,2大2小去，工廠並沒有開放參觀⋯只能選擇4人做4種DIY，250@4也是要1000元（4種DIY@4人份⋯）大人無法只陪同小孩卻只能一起付費做DIY⋯溜滑梯也沒開放⋯現場只有一樓有活動⋯是否值得見仁見智（也許新下雨天沒地方去可以考慮？！）建議可以改為門票與DIY費用/種類分別收費⋯這樣也許可以吸引不進行DIY的遊客⋯
,516,pos,9 個月前,還蠻有趣的，可以自己做彩色筆和蠟筆，和小朋友做很好玩
,517,neg,11 個月前,點餐區專業度有點離譜，點餐機不會用、作餐速度有夠慢，客人排隊一堆，還邊做邊聊天，整體園區規劃可以，但是餐飲小站整個就是0分。
,518,pos,10 個月前,假日人很多，建議早點去，小孩玩得超開心，DIY 很有趣
,519,pos,11 個月前,新館的動線規劃更順暢，多了飲食區，另停車空間也增加許多，還有非常貼心的規劃下雨時親子入口處上下車區，超級推薦帶小孩一遊...
,520,pos,10 個月前,很適合親子遊玩，小孩兒玩得開心，還吵著要在去一次😊
,521,pos,8 個月前,"DIY活動很不錯, 不過時間有點趕"
,522,pos,1 年前,很適合帶小孩子來這邊玩的地方，有各種手做DIY的樂趣可以體驗門票一開始覺得有點貴但看過體驗內容後覺得其實滿划算的蠟筆製作的部分老實說機器數量有點偏少導致等待的時間過久，間接影響後面體驗課程的進度 。另外，門票的部分還包含商品折價券老實說對於商品比較沒興趣的人其實更希望也可以折抵熟食區的商品最後，真的不得不抱怨一下夾娃娃機也太不人性化了還以為會因為有小孩多的場所所以比較好夾一點最後，推薦一下如果體驗完蠟筆工廠的體驗課程可以再往前一點去吃甕窯雞也是不錯的一個搭配方案XDDD
,523,pos,3 個月前,相當用心有特色。
,524,neg,10 個月前,路線規劃的有點慘光大門進去就一團亂連買票的動力都沒有
,525,pos,10 個月前,很適合帶小朋友來體驗DIY做蠟筆、彩色筆、勞作及人體彩繪，很有趣，且可以帶DIY的作品回家。
,526,pos,11 個月前,色彩繽紛，又能diy孩子的生活藝術用品，孩子回味無窮。只可惜若能加上蠟筆生產流程會更扎實
,527,3,2 天前,小孩的玩意兒
,528,pos,8 個月前,適合帶孩子來體驗 自己做臘筆彩色筆 好玩
,529,pos,11 個月前,一張門票可體驗4種好玩的diy活動，還可折抵100元自製商品，孩子和我也有挑戰7樓高的付費溜滑梯，其實並不恐怖噢，很適合所有年齡層一塊遊玩^^！
,530,pos,1 年前,門票250元可以作4種DIY，又可抵用100元商品券很超值，超適合親子家庭。但就一般想了解、參觀蠟筆製作過程的大人遊客來說，可能就失望了，裡面似乎沒有什麼介紹及導覽的地方，只有建築物外觀適合拍拍照而已。
,531,pos,11 個月前,小朋友喜歡，但大人覺得就是一直趕趕趕。每一關的手作都卡好緊，可能人很多，所以需要快一點消化人吧。人多覺得管制沒有很好，可惜。是個覺得哦，來過就不會再來的地方。
,532,pos,10 個月前,很棒的親子手作體驗。孩子玩得很開心，課程導覽和手作課流程安排得很好。
,533,pos,11 個月前,給5顆星，真的不解釋，可學習知識又做DIY，內容豐富，票價可抵商品又包含4樣DIY，足足可待3小時以上，值得真的值得！
,534,3,5 個月前,精美禮品適合小孩子學習和diy
,535,pos,10 個月前,比較適合小學二年級以下的小朋友去玩，旁邊有7-11。
,536,pos,11 個月前,小孩很喜歡課程，會需要花一些時間。小缺點是買回的彩色筆有些還沒用就沒水
,537,pos,4 個月前,帶小孩消耗體力的好地方
,538,pos,10 個月前,雨天活動的好地方，孩子們可以學習動手做
,539,pos,7 個月前,可以讓小孩玩一個上午的好地方
,540,pos,1 年前,"好適合帶孩子來體驗。原本是衝著七層樓溜滑梯而來，結果因為施工要等到八月才開放。門票250可以玩四個DIY,還可以折抵100元買蠟筆，非常超值，附近還有一米特及宜蘭餅觀光工廠，超棒的地方"
,541,pos,11 個月前,非常適合帶孩子來玩，或是和好友來玩，特別是夏天票價250包含三個DIY體驗，非常有趣且票價可抵用館內紀念品區的消費另外還有付費的體驗是個打發時間消暑，又可以長知識的好地方👍
,542,pos,10 個月前,可以讓小朋友做蠟筆及彩色筆的課程，很棒~~工作人員也很親切
,543,pos,2 個月前,帶小朋友來的好地方
,544,pos,11 個月前,很適合帶小孩逛，DIY時間太過倉促。每張門票250還可以折抵100消費，費用算還可以。裡面還有各式各樣的造型衣服提供更換拍照(免費及付費都有）。
,545,3,11 個月前,建築物很特殊。收費有點貴...成人一人250元縣民也才便宜15元雖然是可以讓小朋友體驗但因是本身本地人覺得不是很推薦
,546,3,8 個月前,只有外觀不錯.....帶小孩去應該還可以
,547,pos,10 個月前,讓人驚嘆的視覺建築，帶小朋友來繪畫的好地方
,548,pos,11 個月前,門票250，送個小飾品，可以折抵100元商品，又有4種DIY文具可以做，帶著小孩進去可以消磨很多時間，又讓小孩體驗自己做彩色筆和蠟筆，覺得很值得
,549,3,9 個月前,觀光工廠，可帶小朋友來此實作！
,550,pos,11 個月前,三歲多的小朋友來此處玩，覺得十分儘興，是親子遊可考慮的選項。
,551,pos,11 個月前,適合親子同遊的觀光工廠，提供紙扇面具、蠟筆、彩色筆、手繪紋身……闖關DIY活動👍👍👍
,552,pos,11 個月前,適合小朋友來體驗蠟筆，彩色筆的製作，一張門票可做4項體驗，還可以折100元的產品。
,553,pos,11 個月前,門票雖貴了些250元，但有四項體驗活動加一百元紀念品抵銷費，還算物超所值。值得學習蠟筆由來之旅。
,554,neg,7 個月前,不知道去那裡幹嘛 無聊 有小孩再來
,555,pos,7 個月前,五年前和五年後參觀的景點不一樣
,556,pos,11 個月前,DIY課程內容豐富，但成人也需購票入場，這有點強迫消費，建議酌收成人入場票（不做DIY）即可
,557,neg,9 個月前,結帳速度太慢，都是排隊人龍
,558,pos,9 個月前,很好玩！可以自己做蠟燭和顏色筆，可惜太晚去了，沒有試玩彩虹滑梯。
,559,neg,11 個月前,沒有太大的特色，販賣的東西也不多。適合小朋友去的地方，如果是大人會覺得有點無聊。
,560,3,9 個月前,門票不便宜，促進親子關係倒是可以。
,561,pos,11 個月前,適合親子旅遊 門票內有四項DIY體驗 入場會分場次 參觀內容是在一間一間的DIY教室 必須要跟同梯次的一起行動 四項DIY分別為 扇子面具 彩色筆製作 蠟筆製作 身體彩繪 另外門票可在紀念品店折抵一百元
,562,pos,11 個月前,很適合親子旅行到訪的景點，讓小朋友DIY，自己體驗，真的很棒~
,563,pos,11 個月前,小孩（小二、中班）玩的很開心，推薦可帶小孩來玩玩！
,564,pos,10 個月前,進入與出快速道路之前的如廁停靠點幫車美拍的地點
,565,pos,11 個月前,建築物造型特殊，停車方便。假日時人潮多，動線擁擠，平常日前往較佳。入內需要門票，非門票區可稍作休息。
,566,3,11 個月前,禮拜日中午十一點買票等到十二點的場次進場，等待場地不大，但是進去後因為是一團一團所以管制的不錯，大概三年級以下的小朋友會愛的手作DIY，在台灣有這樣的水準要幫他們拍拍手。
,567,pos,10 個月前,體驗課程規劃的很完善，大人小孩都很適合外面設有停車場，開車來也很方便
,568,pos,10 個月前,DIY很適合親子同樂，可以自己做蠟筆、彩色筆及人體彩繪。
,569,pos,11 個月前,主題體驗十點半沒有名額很可惜，一半體驗導覽解說很清楚，大人小孩玩的很開心，還可以帶成品回家，門票可以抵部分消費換文具用品很喜歡😘
,570,pos,11 個月前,很值得帶小孩去遛達的好所在！環境好、服務好、也講解的很完整！大人也不無聊哦！
,571,neg,11 個月前,門票漲到250，只能抵100，DIY內容多但很趕，看不到生產線
,572,pos,10 個月前,有4個diy課程，小朋友會蠻開心的，大約可以放電1.5小時，不錯
,573,pos,10 個月前,有玩又有小禮物🎁很適合小孩喔😄
,574,pos,11 個月前,剛開始因為門票蠻貴的… 但進去後發現裡面的課程多樣化！ 小朋友玩的非常開心… 門票還可以抵消費，簡直超值！ 強力推薦呀…
,575,pos,5 個月前,不錯，溜小孩的好地方
,576,pos,10 個月前,課程安排的不錯，可能人多帶課的語氣有些趕時間
,577,pos,10 個月前,蠻適合帶小朋友一起參加活動 門票還能折抵部分消費
,578,pos,10 個月前,小孩超喜歡 然後門票又可以抵商品的購買，我覺得很值得
,579,pos,5 個月前,三隻大蠟筆 很有有特色的建築
,580,pos,8 個月前,等我有錢在陪我兒子一起玩...
,581,pos,11 個月前,溜小孩的好去處，好拍好玩消磨時間，也增加知識，平價DIY課程，大小朋友都能玩！
,582,3,11 個月前,價格變高，手作時間也比較短，若想手繪久一點要考慮一下，兒童裝扮服都要額外付錢，雖然有折抵卷但感覺不是太划算
,583,pos,11 個月前,假日很多人，要分批進場，四場實作活動小孩子玩的蠻開心的，可惜沒有製造蠟筆介紹，沒產線參觀。
,584,pos,11 個月前,DIY課程很受小朋友喜歡，還可以抵園區內文具的消費，真的很值得哦
,585,pos,9 個月前,專業製造蠟筆的觀光工廠，親子共遊的好去處
,586,pos,10 個月前,停車位多;隔壁小七、可多休息一下
,587,pos,11 個月前,非常有趣，小孩能闖關玩很久的時間，老人還免入場費，但車位要排
,588,pos,1 年前,進場需要買門票，另可折抵部分商品消費，記得自己把門票保管好。4種DIY體驗還不錯，可以讓小朋友好好玩，比起一些走馬看花拍拍照，剩下就是買東西的觀光工廠用心。但是DIY第3項製作蠟筆的機器真的太少台了，沒搶到第一波的人要等待前面的人做完也就算了，接著時間嚴重不足，會變得非常緊迫。(2019.04)
,589,pos,10 個月前,停車場很大停車方便，旁邊還有便利商店，便利商店後面有廁所。
,590,neg,1 年前,門票250包含4項Diy 100可折抵消費，但是大人也需要跟著做嗎？這種活動就是小孩喜歡，建議業者大人將來可以有100參觀門票，3/19我帶新加坡客人2大2小，售票人員說規定就是如此，結果我的客人沒進去，他們在宜蘭住3天，玩了很多Diy的地方……積木城堡、珍奶博物館、畫框博物館、廣興農場、醫遊館、三義鴨箱寶……我知道客人不是錢的問題，售票人員的應對讓人覺得有待加強，或許我們當時16:20到，可能快下班了……所以他們只能拍拍照就草草離開了………
,591,pos,1 年前,很不錯，雖然要門票，但是每一關的教學成品都可以帶走，最後的人體彩繪，還有道具服裝可借用拍照，出去後還可以折抵產品100元，蠻超值的。停車場大，交通方便，下國五就到
,592,pos,10 個月前,整體的感覺還不錯，如果參加DIY活動可以耗個2個小時。
