_id,sid_comment,star,time,comment
,753,5,,第753篇評論找不到，得用RAWDATA回溯
,754,1,,第754篇評論找不到，得用RAWDATA回溯
,755,4,,第755篇評論找不到，得用RAWDATA回溯
,756,5,,第756篇評論找不到，得用RAWDATA回溯
,757,5,,第757篇評論找不到，得用RAWDATA回溯
,758,5,,第758篇評論找不到，得用RAWDATA回溯
,759,5,,第759篇評論找不到，得用RAWDATA回溯
,760,4,,第760篇評論找不到，得用RAWDATA回溯
,761,3,,第761篇評論找不到，得用RAWDATA回溯
,762,4,,第762篇評論找不到，得用RAWDATA回溯
,763,3,,第763篇評論找不到，得用RAWDATA回溯
,764,5,,第764篇評論找不到，得用RAWDATA回溯
,765,4,,第765篇評論找不到，得用RAWDATA回溯
,766,4,,第766篇評論找不到，得用RAWDATA回溯
,767,5,,第767篇評論找不到，得用RAWDATA回溯
,768,5,,第768篇評論找不到，得用RAWDATA回溯
,769,3,,第769篇評論找不到，得用RAWDATA回溯
,770,4,,第770篇評論找不到，得用RAWDATA回溯
,771,1,,第771篇評論找不到，得用RAWDATA回溯
,772,5,,第772篇評論找不到，得用RAWDATA回溯
,773,5,,第773篇評論找不到，得用RAWDATA回溯
,774,4,,第774篇評論找不到，得用RAWDATA回溯
,775,4,,第775篇評論找不到，得用RAWDATA回溯
,776,4,,第776篇評論找不到，得用RAWDATA回溯
,777,4,,第777篇評論找不到，得用RAWDATA回溯
,778,3,,第778篇評論找不到，得用RAWDATA回溯
,779,5,,第779篇評論找不到，得用RAWDATA回溯
,780,4,,第780篇評論找不到，得用RAWDATA回溯
,781,5,,第781篇評論找不到，得用RAWDATA回溯
,782,3,,第782篇評論找不到，得用RAWDATA回溯
,783,2,,第783篇評論找不到，得用RAWDATA回溯
,784,5,,第784篇評論找不到，得用RAWDATA回溯
,785,4,,第785篇評論找不到，得用RAWDATA回溯
,786,5,,第786篇評論找不到，得用RAWDATA回溯
,787,3,,第787篇評論找不到，得用RAWDATA回溯
,788,1,,第788篇評論找不到，得用RAWDATA回溯
,789,1,,第789篇評論找不到，得用RAWDATA回溯
,790,5,,第790篇評論找不到，得用RAWDATA回溯
,791,4,,第791篇評論找不到，得用RAWDATA回溯
,792,3,,第792篇評論找不到，得用RAWDATA回溯
,793,5,,第793篇評論找不到，得用RAWDATA回溯
,794,3,,第794篇評論找不到，得用RAWDATA回溯
,795,4,,第795篇評論找不到，得用RAWDATA回溯
,796,3,,第796篇評論找不到，得用RAWDATA回溯
,797,4,,第797篇評論找不到，得用RAWDATA回溯
,798,4,,第798篇評論找不到，得用RAWDATA回溯
,799,4,,第799篇評論找不到，得用RAWDATA回溯
,800,4,,第800篇評論找不到，得用RAWDATA回溯
,801,5,,第801篇評論找不到，得用RAWDATA回溯
,802,3,,第802篇評論找不到，得用RAWDATA回溯
,803,3,,第803篇評論找不到，得用RAWDATA回溯
,804,4,,第804篇評論找不到，得用RAWDATA回溯
,805,5,,第805篇評論找不到，得用RAWDATA回溯
,806,3,,第806篇評論找不到，得用RAWDATA回溯
,807,5,,第807篇評論找不到，得用RAWDATA回溯
,808,4,,第808篇評論找不到，得用RAWDATA回溯
,809,4,,第809篇評論找不到，得用RAWDATA回溯
,810,3,,第810篇評論找不到，得用RAWDATA回溯
,811,3,,第811篇評論找不到，得用RAWDATA回溯
,812,5,,第812篇評論找不到，得用RAWDATA回溯
,813,4,,第813篇評論找不到，得用RAWDATA回溯
,814,1,,第814篇評論找不到，得用RAWDATA回溯
,815,5,,第815篇評論找不到，得用RAWDATA回溯
,816,4,,第816篇評論找不到，得用RAWDATA回溯
,817,4,,第817篇評論找不到，得用RAWDATA回溯
,818,4,,第818篇評論找不到，得用RAWDATA回溯
,819,5,,第819篇評論找不到，得用RAWDATA回溯
,820,1,,第820篇評論找不到，得用RAWDATA回溯
