_id,sid_comment,star,time,comment
,1,pos,6 天前,端午節休息兩天，有一天安排到 蠟筆城堡親子活動，入口處有一家7-ELEVEN稍微休息一下。即進入蠟筆城堡， 入口處 有一個大型的溜滑梯 因為我們家的小朋友都太小，所以不敢讓他們嚐試，每人250元可以參加親子活動， 大人小孩都可以玩得很開心，第一個是主持人跟小朋友玩問答活動。第二個是親子畫圖做小彩球。第三個親子組裝彩色筆。第四個是 親子組裝彩色在蠟筆。第五個是人體彩繪，可以在手上和臉上畫畫事後可以用清水洗乾淨。還有海賊船、森林、可愛動物，有提供服裝和道具可以變裝也可以拍照留念 。還有在最一站用入場券可抵100元消費帶回紀念品，總共花了兩個兩個多小時玩得很開心 ，我們帶了好多紀念品回家。從頭到尾全家都玩得很閞心。讚！！
,2,pos,3 天前,停車方便館內也很乾淨，冷氣夜夠涼外觀設計很可愛，大老遠就看到了門票可抵消費進場分時段由老師帶領講解之後DIY第一區是畫畫的（時間有點短）第二區是做彩色筆（組裝彩色筆）第三區是做蠟筆（小蠟塊壓模變成形狀蠟筆）第四區是人體彩繪（水性的很好清洗）最後還有拍照區、用餐區、材料區每一區都有時間限制服務人員態度很好👍🏻每個阿姨都笑咪咪
,3,3,4 天前,蠟筆城堡在宜蘭區，是一個新的親子互動的觀光工廠，有手作區，可以自己動手製作簽字筆、彩色筆；還有製作臘筆的工具讓親子互動學習如何製作出蠟筆，更有繪畫創作的教學，讓孩子們使用無毒的材料畫出自己的風車和身體彩繪，8樓高的溜滑梯更是讓人感覺刺激！有免付費的道具和衣帽裝扮成各種不同的童話人物照像保存在自己的相機中，永恒留存，入園費250元但是可以抵扣消費買產品讓孩子回家時，還可以繪製自己的圖畫！
,4,pos,2 天前,小孩很喜歡，又能增加親子活動。大人小孩門票250可抵100消費購物，共四個DIY套裝行程。空間動線規劃很不錯，裝潢設計有用心台灣少數有品質的觀光工廠。孩子滿滿的禮物，物超所值。好停車冷氣夠冷，暑假避暑親子活動好去處！
,5,3,2 週前,這景點屬於終身一次性的，來過一次不會想再來一次，不管你要不要玩diy你都必須付錢進去。總共有4個diy課程，開場白是去階梯式教室聽解說彩色筆原物料，這個出發點是不錯的，但是一場太多人了，根本亂七八糟的；第一關畫那什麼紙彩球，這根本當下就變垃圾啊～或許是想讓人體驗他家的水彩顏料吧？！第二關自己製作彩色筆，這個對於孩子來說就有教育意義了，讓孩子了解彩色筆怎麼製作而成的，可惜不是桌面顏料都能製作一支；第三關自己製作蠟筆，先去原料區選顏色，之後孩子與爸媽自行操作機器製作，這個也是讓孩子有親身體驗了解到製作過程；第四關人體彩繪，這關就完全太置入性行銷了，完全推廣他家的人體彩繪用品，況且很多人安排行程這屬中間站，沒人會想讓孩子畫的都是，然後去洗手衣服又用的濕答答，然後再去下一站景點。門票可以折抵館內消費，這幾乎是台灣所有觀光工廠流程，讓你帶點伴手禮回家的概念，也讓孩子覺得有帶到東西。一個場次實在太多人了，有夠雜亂無序，工作人員介紹解說太過死板僵硬，完全不吸引小孩。孩子沒來過花一次錢全家進去買個回憶是可以的，反正這景點就是來過一次就謝謝再聯絡了，希望能改善。
,6,3,3 天前,停車場空間大，門口垃圾桶滿到炸開連假人潮絡繹不絕，櫃台上的工作人員忙到炸掉……整個環境空間感到吵雜擁擠髒亂如果想帶孩子來體驗蜡藝的家長請非假日來，這樣子或許能玩到更多
,7,pos,1 週前,這裡非常適合帶著孩子來遊玩的地方，場地寬敞、也有設立闖關活動讓孩子自己去體驗做蠟筆、彩色筆的樂趣❤️每關都會有服務人員解說內容，需要協助時他們也能給予立即的回覆，很棒！很值得二訪的一個地方👍🏻
,8,3,2 天前,整套票使用所有勞作要2小時，適合小孩，小孩會覺得很有趣，大人應該不覺得XXXXXXD。
,9,3,6 天前,有很高的溜滑梯，不過沒有類似玉兔原子筆之類的博物館可以逛，大人可能會比較無聊
,10,pos,1 週前,宜蘭蘇澳蠟藝蠟筆城堡小朋友的最愛和天堂歡迎台灣家長帶小朋友來此一遊 夏天到了冬山河親水公園讓小孩子夏天消暑好去處 附近還有許多景點🤩😋👍
,11,pos,1 週前,門票250元但DIY課有3種可做可拿，門票又可抵消費，ㄧ定要帶孩子來嘗試看看！
,12,pos,1 週前,小孩的天堂，大人也跟著玩，門票還可抵100消費，共四個DIY套裝行程，滿滿的禮物，物超所值。
,13,3,3 天前,城堡很有特色，外圍停車場廣闊，停車方便，我是選擇到小7購買食物，很方便。。
,14,3,2 天前,只適合三歲以上的兒童，建議可以有只陪同進入不DIY的收費。
,15,pos,1 週前,買票能折抵，能自己做彩色筆跟蠟筆還有風車，最後還能彩繪跟變裝拍照！
,16,neg,2 週前,沒有用心經營！以前去過還不錯，後面再去就很差，門票太貴了！
,17,neg,4 週前,除了建築物本體很壯觀外，好像沒什麼可以推薦體驗活動用有四個教學都是放影片講解，用顏料在紙上畫畫、一個人加工三隻彩色筆？？拿顏料教小孩在身上畫畫？！只有一個加工蠟筆壓模成城堡跟這個地方好像比較有關聯一點⋯⋯最後還可以變裝更是不知所云⋯一大一小入場要500元後面可以折抵換一些周邊商品，如果有請人設計一下整體視覺更好⋯⋯不想在多消費，整體感覺不太值得
,18,pos,1 週前,主題性觀光工廠 適合親子同遊的地方旁邊為7-11 便利商店 方停車場:有 免費停車廁所:有
,19,pos,1 週前,門票250可以參與四個小活動包含手做蠟筆還挺不錯的。挺適合小孩與小小孩的體驗。
,20,pos,1 週前,票價250元享有4種體驗，尚可折抵100元商品～物美價廉
,21,pos,4 天前,蠟筆建築超可愛，但內部真的比較適合小小孩來參觀
,22,neg,3 週前,明明是一個要適合帶著孩子去玩的親子體驗觀光工廠，小朋友突發不適隨時可能會嘔吐，向館內多要兩個塑膠袋備著，避免影響其他人及館內清潔，孩子嘔吐也已盡力未影響到館內的員工及遊客，想再多拿兩個「塑膠袋」，館內的販賣部員工竟然態度很不樂意甚至還說前面有拿過塑膠袋了，兩位大人花了500塊的門票，連想多拿一個塑膠袋都要受到這樣不友善待遇！覺得非常不值得前往！
,23,pos,1 週前,大人小孩同票，去就是要畫畫不是去看戲的，沒興趣畫畫的請自動放棄
,24,pos,1 週前,適合帶小朋友造訪，8層樓高的旋轉滑梯值得一試
,25,pos,2 週前,門票可以抵消費，小孩畫圖畫得很開心，又不怕洗不掉
,26,pos,2 週前,250元可作4個DIY，有趣又殺時間喔
,27,neg,4 週前,今天第二次去兩大兩小1000元，真的非常貴第一關跟第四關好無聊、不好玩第四關老師教的櫻花圖案跟上次一樣，沒有什麼變化，覺得很無趣！希望未來1跟4關可以改變一下方式，多跟蠟筆有關的活動，不要再畫紙或彩繪人體了，這些在家也可以自己做，不然再也不會想要去了去了幾次就覺得～貴又不新奇了！
,28,3,1 週前,外面適合拍照(到此一遊)!!! 裡面適合小小朋友
,29,pos,2 週前,小朋友超級開心、館內提供親子體驗活動、可以到櫃臺買票進場喔！製作的東西還會幫你區分適合幾歲的小朋友喔
,30,pos,2 天前,很適合帶小朋友來做DIY，遠傳訊號很好
,31,pos,2 週前,這個點很適合帶小孩來，可以玩，可以DIY創作，只是對成年人稍嫌無聊，不過若你是帶孩子來玩，那麼孩子玩得開心你也跟著高興不是嗎？
,32,pos,2 週前,門票小貴 但能讓小朋友DIY手作 彩色筆 蠟筆 彩繪 現場還有舞台佈置背景 道具等供拍照 商店商品可用門票折抵 整體算豐富還不錯
,33,neg,1 個月前,門票250，體驗項目1.畫紙2.做彩色筆3隻3.做小城堡的蠟筆4.拿顏料畫手?!花這總錢來這這裡體驗這些1跟4的活動真的是很沒意義，也沒什麼蠟筆製作的過程導覽，就是員工放影片給你看然後你照做，大約20分鐘就可以了覺得非常不值得前往
,34,3,2 週前,只要入場一律算diy價格，雖然門票可折抵100購物消費，但還是有種強迫消費的感覺。
,35,pos,2 週前,雖然價格高了些但是有四個DIY活動以大朋友來說1、4的DIY會比較無聊但小朋友玩的不亦樂乎
,36,pos,2 週前,非常好玩，寵物友善的超棒景點！十分推薦有帶寵物的朋友只要有推車提袋都可以帶寵物前往喔！❤️
,37,pos,2 週前,小孩很喜歡的放電好地方。唯工作人員需要多點耐心，不要趕場，小孩無法動作快。
,38,pos,4 週前,室內很大！有冷氣！適合安排雨天備案，一人250元有四項DIY，國小以下可能會比較有興趣參與，工廠強力推薦人體彩繪顏料，如果送的100元不知道換什麼，換這個來畫很有趣哦！
,39,pos,4 週前,會有四個手作主題：1立體塗鴉2製作彩色筆3製作蠟筆4人體彩繪，滿有趣。很適合小孩認識色彩，但講解介紹就少了點。
,40,pos,1 個月前,是個非常適合安排親子活動的好地方，讓孩子能從各式的diy中了解顏料到製作成他們日常使用的畫筆，這些diy規劃真的很棒!只是教室中的因為空間大，講解的老師使用擴音機時，回音非常大，讓聽課的學生耳朵有點受不了，反而聽不清他們說話的內容。
,41,pos,4 天前,可以帶小朋友來玩DIY有4個活動可以參加
,42,pos,2 週前,假日帶小孩一遊的好地方，館內環境乾淨又簡單，導遊的人員服務態度也好
,43,3,1 個月前,門票250元，可以抵扣100元購買商品，城堡外觀漂亮，總共可以體驗4種課程，後面兩個做蠟筆跟畫手的介紹講師，口齒不清，講話全部黏在一起，聽得很吃力，更別說是小朋友更是全部聽不懂，還好有搭配看影片介紹...
,44,pos,1 個月前,🖍️蠟筆城堡🏰的入場導覽&蠟筆DIY，可以感受到規劃的用心與精心設計的動線，讓小小孩清楚了解一隻蠟筆從無到有的過程，簡單的DIY工坊讓小小孩能夠獨自製作屬於自己的畫畫筆，完成✅的成就感與樂趣完全可以顯現在孩子臉上：）是個值得推薦的親子同樂好去處💯
,45,pos,1 個月前,適合3歲以上小朋友來玩Diy，外面拍照很棒，還有一個厲害的溜滑梯。
,46,pos,1 個月前,親子動手做，很棒很好玩。適合大班以上小朋友，可抵100（3人抵300可全折）不像有些地方100抵1樣商品。
,47,pos,4 週前,很棒的地方，能讓小孩自己做彩色筆給蠟筆，體驗手作的樂趣。
,48,pos,1 個月前,路過外圍，覺得很可愛，就把車子開過來樂！剛好裡面還有一間超商，方便補給，廁所也很乾淨☺️☺️👍
,49,pos,3 週前,跟寶貝一起動手做彩色筆、臘比、畫圖增不錯的體驗100元可以抵購物
,50,pos,2 週前,門票包含DIY體驗，還可全額折抵消費，覺得CP挺高的
,51,pos,1 個月前,DIY手作值回票價，門票可完全折抵消費！小孩玩得不亦樂乎！還很享受被畫臉！非常適合小孩！
,52,pos,1 個月前,超棒的親子旅遊館。一共有四個關卡。每個點都有耐心講解及指導。需要門票一人250。每個人都有DIY可操作。
,53,pos,2 週前,溜小孩的地方4個DIY體驗場域小孩子都玩得很開心
,54,pos,2 週前,超級好玩的闖四關，還有8層樓的彩虹溜滑梯。
,55,pos,1 個月前,門票250，3歲以上就要收費。內有四項DIY. 1.蠟筆作畫。2.做彩色筆，一人3隻。3.最蠟筆（壓模）。4.人體彩繪。最後門票可以抵購物，一張抵100。
,56,pos,1 個月前,Sop的流程，做出來的成品都還不錯，每種課程都有專人解說，服務很好，大人很輕鬆，小孩玩的很開心。
,57,pos,3 週前,育教娛樂、 給小朋友 增加知識、 蠟筆水彩筆製造過程、 真的很棒！
,58,3,1 個月前,整體體驗算豐富，有四大手作區域，但總覺得如果整體視覺設計再請專人設計，應該會又有內容又有質感。
,59,pos,1 個月前,門票250可抵用100元有教學人員教制作方法、可惜小朋友太小（2歲4個月）在館內不受控、等大一點再去體驗一次、三樓遛滑梯也限定6歲以上
,60,pos,2 週前,很棒的旅遊中繼站，全程體驗大約耗時二個小時。
,61,pos,1 個月前,"適合親子DIY,小朋友很愛！雨天或大熱天都很適合，只是溜滑梯要另外購票，建議可用折抵就好或一張票可免費溜1⃣️次，不然可惜了"
,62,3,1 個月前,250元門票有四種體驗活動，可抵消費，還不錯可惜，室內親子活動空間少，展售商品侷限在色筆，有聲書已經故障⋯整體環境值得加強
,63,3,1 個月前,安排DIY活動難度對小孩子來說適中，可惜參訪當天無法參觀工廠製程及有些沒開放，人員態度都算蠻親切
,64,pos,2 個月前,對親子遊來說是不錯的點~~一張票有四種體驗可玩~~做蠟筆.彩色筆及彩繪~~一般成人來這就比較無聊~~除了體驗還有一些景可以拍照~但不多~外觀造型很吸睛~~
,65,pos,2 個月前,雖然沒有很大（平面一樓）門票一開始覺得很貴250帶兩個小孩玩了2-3小時，可以自己做彩色筆、蠟筆🖍️人體彩繪🌈最後門票還可以折抵商品，所以帶了蠟筆回家小孩直說好玩，沒去過的認真推薦玩一下👍🏻👍🏻👍🏻
,66,3,2 週前,只適合小孩，大人要陪同進場都要花一樣的錢
,67,pos,2 個月前,門票250 三歲以下免費 每張門票可折抵100元4項動手實作 孩子都能自己做之後商品也算實用 不會有強迫消費的感覺
,68,3,2 週前,2020/6/27時門票一人250，小孩超過三歲就要門票
,69,pos,1 個月前,以親子來說算是個好地方小朋友很喜歡門票能抵商品覺得划算
,70,pos,2 週前,育教娛樂的好地方 門票可以抵100消費換蠟筆
,71,pos,2 個月前,門票250/人1.體驗畫畫2.做彩色筆 一張票3隻3.做蠟筆 一張票1組4.人體彩繪體驗4種DIY2、3很新鮮，非常有意思很棒的觀光工廠體驗。搭彩虹溜滑梯門票再加100元最後可以用門票兌換一些紀念品我們有兌換50元一組的蠟筆鑰匙圈四組超可愛❤️
,72,neg,2 個月前,蠟筆建築物相當吸引人，但親子製程活動真的還好！有點拖時間
,73,pos,2 個月前,大部份是賣吃吃喝喝，大廳有擺幾件工廠退役物品給人免費參觀，想體驗手作能買票入場親子同樂的地方。
,74,pos,3 週前,"Towering incredible, road signs around Yilan Suao A crayon castle that recalls childhood memories.高聳不可思議，宜蘭蘇澳週邊路標讓人回憶起童年回憶的蠟筆城堡。"
,75,pos,1 個月前,一張門票就可以體驗到4種DIY!超值又好玩!!
,76,neg,1 個月前,廁所又髒又臭，帶小孩的要有心理準備！
,77,pos,1 個月前,進出蘇花改最佳休息站，好停車，補給方便
,78,pos,2 個月前,整體規劃不錯 比一般的觀光工廠更適合親子 餐點再加強點會更棒
,79,pos,1 天前,溜滑梯要另外付費。
,80,pos,2 個月前,可以體驗做蠟筆跟彩色筆，大人小孩都值得來一趟👍
,81,pos,1 個月前,小孩的好去處，但DIY很多時間很長！
,82,pos,3 個月前,很適合寓教於樂的地方.門票還可折抵100元全額抵買商品.動作DIY蠟筆.彩色筆.人體彩繪都很適合讓小孩從動手做中學習~建築物外觀更是一大亮點!
,83,pos,2 個月前,很適合親子同遊的觀光工廠，門票內含的手工製作有寓教於樂的效果
,84,pos,3 個月前,雨備計畫，蠟筆城堡有約1小時的蠟筆製作DIY跟自費的七層高溜滑梯，是個下雨天殺時間或團體活動的好地方。
,85,pos,3 個月前,地點不錯 ，是國5高速公路 ，蘇澳出口端 ，很棒的休息的地方、上廁所、飲食都很方便，打卡拍照也很美 。
,86,pos,2 週前,可以帶著孩子去殺殺時間，放放電
,87,pos,1 個月前,非常適合學齡前的孩子，Diy很豐富也好玩！
,88,pos,6 個月前,這裡很像大型溜小孩的工廠，門票的費用和你要參加的關是有關係的，半小時進場一次，一次進去約60人，在等待的時候，就從玻璃窗看到裡面畫面具，小孩子玩得很開心，大人也可以休息一下，總共分為四關：視聽教室聽課、畫面具🎭、做彩色筆、用廢棄的蠟筆🖍️壓模做成成品，而後的換裝秀是加購價，大概是20-30分鐘一關，一次下來也需要約兩個小時，很適合親子！本來還有從2樓可以滑到1樓的溜滑梯，不過去的時候已經在維修了，有點可惜。外面停車場很大，停車方便，也有很多遊覽車。對面100公尺，就可以看到宜蘭餅觀光工廠，這附近觀光工廠就像一個群落，總共有三個聚落，分別在羅東、宜蘭（近礁溪）蘇澳），建議可以花一兩天整天好好的參觀宜蘭觀光工廠，各有特色！
,89,pos,1 天前,不受艷陽高溫影響的好去處
,90,pos,3 個月前,很適合帶小朋友來體驗八層樓的溜滑梯千萬不能錯過溜下來大概13秒手作體驗課也非常棒
,91,pos,6 個月前,竟然能把製程其實很無趣的工廠，變成一個這麼多體驗又有趣的活動設計；雖然自己的圖真的畫得不夠好看，但是過程的體驗讓人印象深刻，要理解索然無味的生產過程就看牆上的海報或是大廳展示區的陳設機具，不用操煩小朋友會無聊，因為緊湊的活動設計會讓他們忙得不可開交；館內的陳設充滿色彩繽紛的童趣，商品規劃也很重視小朋友選擇跟大人選擇的差異，高聳的蠟筆造型建築物更是從新馬車站及高速公路就能眺望得到；展區規劃完整的環狀動線不怕迷路，那高聳的彩虹溜滑梯實在很刺激，畢竟是全密閉的滑梯空間會製造壓迫緊張感，十秒上下就會從頂樓溜下來，Very好玩。
,92,pos,3 個月前,適合帶小孩來做繪畫體驗的觀光工廠，地點在工業區內，從高速公路上就可遠遠看見外觀的大蠟筆，附近不太好停車，需要花時間找一下。抵達地點之後，就可以循著路線開始做體驗，親子互動體驗的有繪畫區，可以選好主題來畫畫。另外有個溜滑梯很適合小孩玩耍。門票可以抵消費，若有需要可以採購蠟筆或其他商品。
,93,neg,1 個月前,三歲以上門票都要250實在很扯！
,94,pos,3 個月前,在高速公路上就可以看到非常顯眼的蠟筆城堡沒有買門票入場是看不到什麼特別的東西，但有看到許多家長帶小朋友去DIY活動，蠻有學習與遊戲的效果的
,95,3,4 個月前,外觀拍照很讚的地方，沒買門票的話就只有一樓小小的區域可以逛，免錢的部分看到製作機器和影片，旁邊的購物區就值得找找驚喜購票可以體驗製作的樣子，就留給親子活動會比較適合，除了這裡能逛，附近走路也有其他景點可以看
,96,3,1 週前,這裡只適合有帶小孩的來花錢
,97,neg,5 個月前,門票沒有分大人小孩都是一人250元，有種被強迫體驗DIY的感覺，因為這是大人帶小孩去體驗的地方，大人確也要被迫交250元體驗DIY進去後也沒有導覽彩色筆及蠟筆的知識，只有放影片教大家怎麼組裝彩色筆及蠟筆，然後就匆匆要大家趕緊進行下一關體驗，說是可DIY四種體驗，但每關都感覺只是為了讓客人趕快把自己DIY的筆做一做帶回家，好讓下一批客人接著進來體驗，門票250元抵消費是100元，ㄧ家四口去最低消費就是要1000元，說是每人可換100元商品其實就是買商品，而且很難換到剛好，大部分還是要加錢或犧牲餘額
,98,pos,3 天前,天氣炎熱適合小孩遊玩的好地方！
,99,pos,4 個月前,彩虹溜滑梯，讓孩子超開心地，8樓高只要特價100，超值得的還有老師們都很認真的教導大家喔
,100,neg,3 週前,想純逛街的奉勸不要去，要門票
,101,pos,3 個月前,蜡藝蠟筆城堡，專為誘導兒童發揮藝術設計繪畫及智慧創意，酌收門票，閤家一起，陪同主人翁入內，參與活動，適合假日兼旅遊，來者踴躍喔!
,102,pos,3 個月前,"可以讓小朋友體驗DIY做蠟筆,門票可以抵商品,只是四歲的小朋友也要成人票感覺就比較不理想😂"
,103,pos,1 個月前,老少咸宜~體驗做蠟筆！很好玩
,104,pos,4 個月前,喜歡讓孩子親手做蠟筆跟彩色筆的感覺，人體彩繪的部分自己畫個鬼臉追著孩子跑也很讚！
,105,pos,5 個月前,0-3歲的兒童能挑的展場商品真的不是很多呀大豆超人蠟筆的外盒子標示一邊寫著禁止0-3歲使用，另一邊卻又寫適合0-3歲真的很鬧，外包裝可以先去旁邊猜拳一下嗎XD整體而言是不錯的！值得帶小朋友來玩，有四種體驗活動還有提供讓小朋友可以拍攝的衣服租借服務彩虹溜滑梯很新奇，只可惜來的時間沒有開放
,106,3,1 週前,DIY不錯但不好逛來一次就好
,107,3,4 個月前,寓教於樂的場所，不過把吸煙區設在門口旁真的很糟，帶小朋友進出都會被二手煙攻擊，二手煙也一直往裡面展區飄，糟透了，這點沒改善不會再去
,108,pos,1 週前,適合全家大小來到這diy🖍
,109,pos,3 個月前,適合帶家人 一起來的地方cp值超高輕鬆的就打發時間2小時了
,110,3,4 個月前,一個可以讓小孩子玩的地點，有一個很高的滑梯。缺點是消費價格偏高，物品跟餐點選擇性較少。
,111,pos,4 個月前,這裡非常適合爸媽帶10歲以下的小朋友來，假日不分大人還是小朋友，門票一律250塊，100公分以下的小朋友免費，裡面總共有好幾個DIY活動，製作彩色筆、蠟筆等等，也有工作人員會講解如何製作，也順便可以教育小朋友這些東西是怎麼來的，很不錯的親子地方
,112,pos,1 個月前,拍照不錯DIY手作也可以試看看
,113,pos,4 個月前,2020/10/23日，有特色的景點之一就是裡面對小孩來說，門票價格有點貴....有些設施也還沒有開放外面的廁所很乾淨明亮。
,114,pos,1 個月前,體驗蠟筆彩色筆製作，cp值很高
,115,pos,3 個月前,DIY門票可抵文具用品 很棒 能讓小孩有深刻的印象
,116,pos,5 個月前,🖍️蠟筆城堡🏰的入場導覽&蠟筆DIY，可以感受到規劃的用心與精心設計的動線，讓小小孩清楚了解一隻蠟筆從無到有的過程，簡單的DIY工坊讓小小孩能夠獨自製作屬於自己的畫畫筆，完成✅的成就感與樂趣完全可以顯現在孩子臉上：）是個值得推薦的親子同樂好去處💯
,117,pos,5 個月前,很不錯的觀光工廠，入門票250元，價格雖然稍高，但是包含4個diy體驗，彩球製作，彩色筆製作，蠟筆製作，人體彩繪等等，製作的成品可以自己留做紀念品，另外，門票也可以抵100元消費，在最後出口有紀念商品區，大部分商品都是可以全額抵用，算是蠻佛心的。工廠內還有一座8樓高度的彩虹溜滑梯，遊玩需要另外付費100元，如果想要體驗一下可以嘗試看看喔！
,118,pos,3 個月前,小朋友很喜歡但是第二次再去的話可能就比較沒驚喜
,119,pos,4 個月前,是個親子同遊的好地方，裡面有個八層樓高的溜滑梯，可以說是非常刺激
,120,pos,4 個月前,很棒的親子地點，門票250可以參與四個課程。是目前玩過最有內容的觀光工廠💯💯💯
,121,3,2 個月前,看到收費的門口，基本就會省下進去的時間了
,122,pos,4 個月前,1.推薦參加親子手做一般DIY課程，沒有DIY就比較無聊；除了一般DIY課程，也提供進階DIY。2.每一種DIY適合安排2-2.5小時的體驗時間。
,123,pos,4 個月前,入場費250元，可以玩四種DIY ，一個畫小圓盤，製作彩色筆跟蠟筆，在來個身體彩繪，然後還可以買個100元的筆類！我覺得還蠻值得的！
,124,pos,4 個月前,時間不夠，沒有參加最後導覽，外面很好拍照，裡面有個彩色溜滑梯，旁邊的7-11很有主題性的外觀，附近有幾個觀光景點，回家後畫了一張城堡的外觀～表示到此一遊～
,125,neg,4 個月前,不参加活動幾乎沒什麼可逛，三歲以下小朋友沒東西可玩，還不如去旁邊逛7-11
,126,pos,4 個月前,適合帶孩子來看看蠟筆的製作方法的地方，又在國道五蘇澳下來的地方，交通算是非常方便。
,127,pos,4 個月前,小朋友跟大人，都可以玩的忘我門票很值回票價有體驗做蠟筆還有裡面商品都不貴很適合買給小朋友去畫畫，也可送人
,128,pos,2 週前,很方便的休息站，也是宜蘭名地標
,129,pos,4 個月前,適合小朋友，但是每堂課的時間很匆促，沒有好好感受就得趕下一個Diy課程啦～
,130,pos,4 個月前,門票250元有4個手做課程及100元商品抵用券，雖然內容比以前縮水，但整體而言還算不錯。
