_id,sid_comment,star,time,comment
,127,5,,第127篇評論找不到，得用RAWDATA回溯
,128,4,,優點：工作人員熱情、有耐心互動體驗區很多小贈品很多適合小朋友（3-8歲）室內全冷氣購買門票可以抵消費（換飲料、盆栽等）有各國的陀螺跟相關知識缺點：門票門檻偏高大人會有點無聊指尖陀螺能玩的種類有點少展館拿掉互動區能逛的部份很少無停車場（自己路邊停車）有小朋友的話很推薦，因為小朋友可以玩可以拿一堆贈品，小朋友會很開心，大人大概顧即可，工作人員會幫忙把小孩的電耗完，然後到咖啡廳喝個飲料吃個冰淇淋就好。咖啡廳旁邊還有可以餵魚餵鴛鴦，飼料一包 10元，花20元就可以讓小孩玩很開心，只是護欄網全包住，很難餵食，而且蚊子很多，小朋友待一下就被叮了七、八包，可能要噴個防蚊的再出去餵食比較好。可以看出老闆的用心經營，找了很多熱心又親切的員工，也收集各種以及各國的陀螺，但因為門票是 200元，如果爸媽帶小孩兩個，這樣就要 800，五個人就要一千，嚴格來說，費用上可能會讓人皺一下眉頭，如果門票可以定在 100、150 左右的話，可能會更多人去，參觀日是星期六下午，但是遊客不超過 30個，參觀品質是很好，但是對於商家來說客人太少。可能因為人事成本高，再加上各項內容維護，所以門票門檻就相對高一些，如果進入的門檻可以再調整，或是可以抵扣 100元 的餐點，我想應該會更好推廣。
,129,5,,第129篇評論找不到，得用RAWDATA回溯
,130,5,,第130篇評論找不到，得用RAWDATA回溯
,131,5,,第131篇評論找不到，得用RAWDATA回溯
,132,5,,第132篇評論找不到，得用RAWDATA回溯
,133,5,,第133篇評論找不到，得用RAWDATA回溯
,134,5,,第134篇評論找不到，得用RAWDATA回溯
,135,3,,第135篇評論找不到，得用RAWDATA回溯
,136,5,,第136篇評論找不到，得用RAWDATA回溯
,137,5,,第137篇評論找不到，得用RAWDATA回溯
,138,5,,第138篇評論找不到，得用RAWDATA回溯
,139,4,,第139篇評論找不到，得用RAWDATA回溯
,140,5,,第140篇評論找不到，得用RAWDATA回溯
,141,5,,第141篇評論找不到，得用RAWDATA回溯
,142,5,,第142篇評論找不到，得用RAWDATA回溯
,143,5,,第143篇評論找不到，得用RAWDATA回溯
,144,4,,第144篇評論找不到，得用RAWDATA回溯
,145,5,,第145篇評論找不到，得用RAWDATA回溯
,146,5,,第146篇評論找不到，得用RAWDATA回溯
,147,5,,第147篇評論找不到，得用RAWDATA回溯
,148,5,,第148篇評論找不到，得用RAWDATA回溯
,149,5,,第149篇評論找不到，得用RAWDATA回溯
,150,5,,第150篇評論找不到，得用RAWDATA回溯
,151,5,,第151篇評論找不到，得用RAWDATA回溯
,152,5,,第152篇評論找不到，得用RAWDATA回溯
,153,5,,第153篇評論找不到，得用RAWDATA回溯
,154,5,,第154篇評論找不到，得用RAWDATA回溯
,155,5,,第155篇評論找不到，得用RAWDATA回溯
,156,5,,第156篇評論找不到，得用RAWDATA回溯
,157,5,,第157篇評論找不到，得用RAWDATA回溯
,158,5,,第158篇評論找不到，得用RAWDATA回溯
,159,4,,第159篇評論找不到，得用RAWDATA回溯
,160,5,,第160篇評論找不到，得用RAWDATA回溯
,161,5,,第161篇評論找不到，得用RAWDATA回溯
,162,4,,第162篇評論找不到，得用RAWDATA回溯
,163,5,,第163篇評論找不到，得用RAWDATA回溯
,164,3,,第164篇評論找不到，得用RAWDATA回溯
,165,2,,第165篇評論找不到，得用RAWDATA回溯
,166,5,,第166篇評論找不到，得用RAWDATA回溯
,167,5,,第167篇評論找不到，得用RAWDATA回溯
,168,5,,第168篇評論找不到，得用RAWDATA回溯
,169,4,,第169篇評論找不到，得用RAWDATA回溯
,170,5,,第170篇評論找不到，得用RAWDATA回溯
,171,5,,第171篇評論找不到，得用RAWDATA回溯
,172,5,,第172篇評論找不到，得用RAWDATA回溯
,173,5,,第173篇評論找不到，得用RAWDATA回溯
,174,3,,第174篇評論找不到，得用RAWDATA回溯
,175,5,,第175篇評論找不到，得用RAWDATA回溯
,176,5,,第176篇評論找不到，得用RAWDATA回溯
,177,5,,第177篇評論找不到，得用RAWDATA回溯
,178,4,,第178篇評論找不到，得用RAWDATA回溯
,179,5,,第179篇評論找不到，得用RAWDATA回溯
,180,5,,第180篇評論找不到，得用RAWDATA回溯
,181,5,,第181篇評論找不到，得用RAWDATA回溯
,182,5,,第182篇評論找不到，得用RAWDATA回溯
,183,1,,第183篇評論找不到，得用RAWDATA回溯
,184,5,,第184篇評論找不到，得用RAWDATA回溯
,185,4,,第185篇評論找不到，得用RAWDATA回溯
,186,5,,第186篇評論找不到，得用RAWDATA回溯
,187,5,,第187篇評論找不到，得用RAWDATA回溯
,188,5,,第188篇評論找不到，得用RAWDATA回溯
,189,5,,第189篇評論找不到，得用RAWDATA回溯
,190,2,,第190篇評論找不到，得用RAWDATA回溯
,191,5,,第191篇評論找不到，得用RAWDATA回溯
,192,2,,第192篇評論找不到，得用RAWDATA回溯
,193,5,,第193篇評論找不到，得用RAWDATA回溯
,194,5,,第194篇評論找不到，得用RAWDATA回溯
,195,1,,第195篇評論找不到，得用RAWDATA回溯
,196,5,,第196篇評論找不到，得用RAWDATA回溯
,197,5,,第197篇評論找不到，得用RAWDATA回溯
,198,5,,第198篇評論找不到，得用RAWDATA回溯
,199,5,,第199篇評論找不到，得用RAWDATA回溯
,200,3,,第200篇評論找不到，得用RAWDATA回溯
,201,4,,第201篇評論找不到，得用RAWDATA回溯
,202,5,,第202篇評論找不到，得用RAWDATA回溯
,203,5,,第203篇評論找不到，得用RAWDATA回溯
,204,5,,第204篇評論找不到，得用RAWDATA回溯
,205,5,,第205篇評論找不到，得用RAWDATA回溯
,206,5,,第206篇評論找不到，得用RAWDATA回溯
,207,5,,第207篇評論找不到，得用RAWDATA回溯
,208,5,,第208篇評論找不到，得用RAWDATA回溯
,209,3,,第209篇評論找不到，得用RAWDATA回溯
,210,5,,第210篇評論找不到，得用RAWDATA回溯
,211,5,,第211篇評論找不到，得用RAWDATA回溯
,212,5,,第212篇評論找不到，得用RAWDATA回溯
,213,5,,第213篇評論找不到，得用RAWDATA回溯
,214,5,,第214篇評論找不到，得用RAWDATA回溯
,215,5,,第215篇評論找不到，得用RAWDATA回溯
,216,5,,第216篇評論找不到，得用RAWDATA回溯
,217,3,,第217篇評論找不到，得用RAWDATA回溯
,218,5,,第218篇評論找不到，得用RAWDATA回溯
,219,4,,第219篇評論找不到，得用RAWDATA回溯
,220,5,,第220篇評論找不到，得用RAWDATA回溯
,221,5,,第221篇評論找不到，得用RAWDATA回溯
,222,5,,第222篇評論找不到，得用RAWDATA回溯
,223,5,,第223篇評論找不到，得用RAWDATA回溯
,224,5,,第224篇評論找不到，得用RAWDATA回溯
,225,5,,第225篇評論找不到，得用RAWDATA回溯
,226,1,,第226篇評論找不到，得用RAWDATA回溯
,227,2,,第227篇評論找不到，得用RAWDATA回溯
,228,5,,有趣新鮮的忍者體驗適合親子同遊工作人員親切幽默
,229,5,,第229篇評論找不到，得用RAWDATA回溯
,230,3,,第230篇評論找不到，得用RAWDATA回溯
,231,5,,第231篇評論找不到，得用RAWDATA回溯
,232,5,,第232篇評論找不到，得用RAWDATA回溯
,233,5,,第233篇評論找不到，得用RAWDATA回溯
,234,5,,第234篇評論找不到，得用RAWDATA回溯
,235,5,,第235篇評論找不到，得用RAWDATA回溯
,236,4,,第236篇評論找不到，得用RAWDATA回溯
,237,5,,第237篇評論找不到，得用RAWDATA回溯
,238,5,,第238篇評論找不到，得用RAWDATA回溯
,239,4,,第239篇評論找不到，得用RAWDATA回溯
,240,5,,第240篇評論找不到，得用RAWDATA回溯
,241,5,,第241篇評論找不到，得用RAWDATA回溯
,242,5,,第242篇評論找不到，得用RAWDATA回溯
,243,4,,第243篇評論找不到，得用RAWDATA回溯
,244,4,,第244篇評論找不到，得用RAWDATA回溯
,245,5,,第245篇評論找不到，得用RAWDATA回溯
,246,4,,第246篇評論找不到，得用RAWDATA回溯
,247,5,,第247篇評論找不到，得用RAWDATA回溯
,248,5,,第248篇評論找不到，得用RAWDATA回溯
,249,5,,第249篇評論找不到，得用RAWDATA回溯
,250,5,,第250篇評論找不到，得用RAWDATA回溯
,251,5,,第251篇評論找不到，得用RAWDATA回溯
,252,5,,第252篇評論找不到，得用RAWDATA回溯
,253,5,,第253篇評論找不到，得用RAWDATA回溯
,254,4,,第254篇評論找不到，得用RAWDATA回溯
,255,4,,第255篇評論找不到，得用RAWDATA回溯
,256,5,,第256篇評論找不到，得用RAWDATA回溯
,257,5,,第257篇評論找不到，得用RAWDATA回溯
,258,4,,第258篇評論找不到，得用RAWDATA回溯
,259,2,,第259篇評論找不到，得用RAWDATA回溯
,260,5,,第260篇評論找不到，得用RAWDATA回溯
,261,5,,第261篇評論找不到，得用RAWDATA回溯
,262,5,,第262篇評論找不到，得用RAWDATA回溯
,263,5,,第263篇評論找不到，得用RAWDATA回溯
,264,5,,第264篇評論找不到，得用RAWDATA回溯
,265,5,,第265篇評論找不到，得用RAWDATA回溯
,266,5,,第266篇評論找不到，得用RAWDATA回溯
,267,5,,第267篇評論找不到，得用RAWDATA回溯
,268,5,,第268篇評論找不到，得用RAWDATA回溯
,269,3,,第269篇評論找不到，得用RAWDATA回溯
,270,3,,第270篇評論找不到，得用RAWDATA回溯
,271,5,,第271篇評論找不到，得用RAWDATA回溯
,272,3,,第272篇評論找不到，得用RAWDATA回溯
,273,5,,第273篇評論找不到，得用RAWDATA回溯
,274,5,,第274篇評論找不到，得用RAWDATA回溯
,275,5,,第275篇評論找不到，得用RAWDATA回溯
,276,5,,第276篇評論找不到，得用RAWDATA回溯
,277,5,,第277篇評論找不到，得用RAWDATA回溯
,278,5,,第278篇評論找不到，得用RAWDATA回溯
,279,4,,第279篇評論找不到，得用RAWDATA回溯
,280,5,,第280篇評論找不到，得用RAWDATA回溯
,281,5,,第281篇評論找不到，得用RAWDATA回溯
,282,5,,第282篇評論找不到，得用RAWDATA回溯
,283,3,,第283篇評論找不到，得用RAWDATA回溯
,284,5,,第284篇評論找不到，得用RAWDATA回溯
,285,3,,第285篇評論找不到，得用RAWDATA回溯
,286,5,,第286篇評論找不到，得用RAWDATA回溯
,287,5,,第287篇評論找不到，得用RAWDATA回溯
,288,5,,第288篇評論找不到，得用RAWDATA回溯
,289,5,,第289篇評論找不到，得用RAWDATA回溯
,290,4,,第290篇評論找不到，得用RAWDATA回溯
,291,5,,第291篇評論找不到，得用RAWDATA回溯
,292,5,,第292篇評論找不到，得用RAWDATA回溯
,293,5,,第293篇評論找不到，得用RAWDATA回溯
,294,5,,門票一人200元，有50元餐飲或盆栽抵用券還送每人一組泡綿指尖陀螺有各種陀螺展示還有闖關活動關主跟導覽員都很客氣有禮園區也有盪鞦韆跟花卉可以欣賞是個舒服、悠閒，小朋友也可以放電的好地方
,295,5,,第295篇評論找不到，得用RAWDATA回溯
,296,2,,第296篇評論找不到，得用RAWDATA回溯
,297,5,,第297篇評論找不到，得用RAWDATA回溯
,298,5,,第298篇評論找不到，得用RAWDATA回溯
,299,5,,第299篇評論找不到，得用RAWDATA回溯
,300,5,,第300篇評論找不到，得用RAWDATA回溯
,301,4,,第301篇評論找不到，得用RAWDATA回溯
,302,3,,第302篇評論找不到，得用RAWDATA回溯
,303,5,,第303篇評論找不到，得用RAWDATA回溯
,304,5,,第304篇評論找不到，得用RAWDATA回溯
,305,5,,第305篇評論找不到，得用RAWDATA回溯
,306,5,,第306篇評論找不到，得用RAWDATA回溯
,307,4,,第307篇評論找不到，得用RAWDATA回溯
,308,5,,第308篇評論找不到，得用RAWDATA回溯
,309,5,,第309篇評論找不到，得用RAWDATA回溯
,310,5,,第310篇評論找不到，得用RAWDATA回溯
,311,5,,第311篇評論找不到，得用RAWDATA回溯
,312,5,,第312篇評論找不到，得用RAWDATA回溯
,313,5,,第313篇評論找不到，得用RAWDATA回溯
,314,5,,第314篇評論找不到，得用RAWDATA回溯
,315,5,,第315篇評論找不到，得用RAWDATA回溯
,316,5,,第316篇評論找不到，得用RAWDATA回溯
,317,5,,第317篇評論找不到，得用RAWDATA回溯
,318,5,,第318篇評論找不到，得用RAWDATA回溯
,319,5,,第319篇評論找不到，得用RAWDATA回溯
,320,4,,孩子玩的很高興大概待個1-2小時就夠了門票200可以換一杯紅茶或小盆栽一張門票送一個DIY指尖陀螺
,321,5,,第321篇評論找不到，得用RAWDATA回溯
,322,5,,第322篇評論找不到，得用RAWDATA回溯
,323,4,,第323篇評論找不到，得用RAWDATA回溯
,324,5,,第324篇評論找不到，得用RAWDATA回溯
,325,5,,第325篇評論找不到，得用RAWDATA回溯
,326,5,,第326篇評論找不到，得用RAWDATA回溯
,327,5,,第327篇評論找不到，得用RAWDATA回溯
,328,5,,第328篇評論找不到，得用RAWDATA回溯
,329,4,,第329篇評論找不到，得用RAWDATA回溯
,330,5,,第330篇評論找不到，得用RAWDATA回溯
,331,5,,第331篇評論找不到，得用RAWDATA回溯
,332,5,,第332篇評論找不到，得用RAWDATA回溯
,333,5,,第333篇評論找不到，得用RAWDATA回溯
,334,5,,第334篇評論找不到，得用RAWDATA回溯
,335,5,,第335篇評論找不到，得用RAWDATA回溯
,336,5,,第336篇評論找不到，得用RAWDATA回溯
,337,3,,第337篇評論找不到，得用RAWDATA回溯
,338,5,,第338篇評論找不到，得用RAWDATA回溯
,339,5,,第339篇評論找不到，得用RAWDATA回溯
,340,5,,第340篇評論找不到，得用RAWDATA回溯
,341,5,,第341篇評論找不到，得用RAWDATA回溯
,342,5,,第342篇評論找不到，得用RAWDATA回溯
,343,3,,第343篇評論找不到，得用RAWDATA回溯
,344,3,,第344篇評論找不到，得用RAWDATA回溯
,345,3,,第345篇評論找不到，得用RAWDATA回溯
,346,5,,參觀的行程太短，工作人員只有三位，在闖關時候會擠在一起，工作人員態度很好，而且感覺筋疲力盡。園區內還有咖啡可以喝，也可以買些花草回家，算是可以悠閒的渡過親子時間的地方。停車可直接的停在外面的路上，但導航行並不會直接的到門口，而是要再往前一點。
,347,5,,第347篇評論找不到，得用RAWDATA回溯
,348,4,,第348篇評論找不到，得用RAWDATA回溯
,349,5,,第349篇評論找不到，得用RAWDATA回溯
,350,5,,第350篇評論找不到，得用RAWDATA回溯
,351,3,,第351篇評論找不到，得用RAWDATA回溯
,352,4,,第352篇評論找不到，得用RAWDATA回溯
,353,5,,第353篇評論找不到，得用RAWDATA回溯
,354,3,,第354篇評論找不到，得用RAWDATA回溯
,355,5,,第355篇評論找不到，得用RAWDATA回溯
,356,5,,第356篇評論找不到，得用RAWDATA回溯
,357,5,,第357篇評論找不到，得用RAWDATA回溯
,358,1,,第358篇評論找不到，得用RAWDATA回溯
,359,5,,第359篇評論找不到，得用RAWDATA回溯
,360,3,,第360篇評論找不到，得用RAWDATA回溯
,361,5,,第361篇評論找不到，得用RAWDATA回溯
,362,5,,第362篇評論找不到，得用RAWDATA回溯
,363,5,,第363篇評論找不到，得用RAWDATA回溯
,364,5,,第364篇評論找不到，得用RAWDATA回溯
,365,5,,第365篇評論找不到，得用RAWDATA回溯
,366,5,,第366篇評論找不到，得用RAWDATA回溯
,367,5,,第367篇評論找不到，得用RAWDATA回溯
,368,5,,第368篇評論找不到，得用RAWDATA回溯
,369,5,,第369篇評論找不到，得用RAWDATA回溯
,370,5,,第370篇評論找不到，得用RAWDATA回溯
,371,5,,第371篇評論找不到，得用RAWDATA回溯
,372,5,,第372篇評論找不到，得用RAWDATA回溯
,373,5,,第373篇評論找不到，得用RAWDATA回溯
,374,4,,第374篇評論找不到，得用RAWDATA回溯
,375,4,,第375篇評論找不到，得用RAWDATA回溯
,376,5,,第376篇評論找不到，得用RAWDATA回溯
,377,5,,第377篇評論找不到，得用RAWDATA回溯
,378,5,,第378篇評論找不到，得用RAWDATA回溯
,379,5,,第379篇評論找不到，得用RAWDATA回溯
,380,5,,第380篇評論找不到，得用RAWDATA回溯
,381,5,,第381篇評論找不到，得用RAWDATA回溯
,382,3,,第382篇評論找不到，得用RAWDATA回溯
,383,5,,第383篇評論找不到，得用RAWDATA回溯
,384,5,,第384篇評論找不到，得用RAWDATA回溯
,385,5,,第385篇評論找不到，得用RAWDATA回溯
,386,5,,第386篇評論找不到，得用RAWDATA回溯
,387,5,,第387篇評論找不到，得用RAWDATA回溯
,388,4,,第388篇評論找不到，得用RAWDATA回溯
,389,3,,第389篇評論找不到，得用RAWDATA回溯
,390,5,,第390篇評論找不到，得用RAWDATA回溯
,391,3,,第391篇評論找不到，得用RAWDATA回溯
,392,5,,第392篇評論找不到，得用RAWDATA回溯
,393,5,,第393篇評論找不到，得用RAWDATA回溯
,394,5,,第394篇評論找不到，得用RAWDATA回溯
,395,3,,第395篇評論找不到，得用RAWDATA回溯
,396,5,,第396篇評論找不到，得用RAWDATA回溯
,397,5,,第397篇評論找不到，得用RAWDATA回溯
,398,5,,第398篇評論找不到，得用RAWDATA回溯
,399,4,,第399篇評論找不到，得用RAWDATA回溯
,400,5,,這裡有小花園✨，還有咖啡館✨，小孩可以在外面玩盪鞦韆，悠哉的騎著腳踏車。大人累了可以去兌換飲品，也悠哉的坐在旁邊享受前方的美景。後面還有類似生態池的魚池✨，投十塊錢給企鵝就有一包魚飼料。原來一顆小小到陀螺那麼有趣！不同的玩法、造型、歷史！真的是讓人大開眼界！接下來的美景及DIY就留一點神秘感，給準備要來的你吧！✨『這個地方大推！』♥♥♥♥
,401,5,,第401篇評論找不到，得用RAWDATA回溯
,402,5,,第402篇評論找不到，得用RAWDATA回溯
,403,4,,第403篇評論找不到，得用RAWDATA回溯
,404,3,,第404篇評論找不到，得用RAWDATA回溯
,405,5,,第405篇評論找不到，得用RAWDATA回溯
,406,5,,第406篇評論找不到，得用RAWDATA回溯
,407,5,,第407篇評論找不到，得用RAWDATA回溯
,408,4,,第408篇評論找不到，得用RAWDATA回溯
,409,4,,第409篇評論找不到，得用RAWDATA回溯
,410,4,,第410篇評論找不到，得用RAWDATA回溯
,411,3,,第411篇評論找不到，得用RAWDATA回溯
,412,5,,第412篇評論找不到，得用RAWDATA回溯
,413,4,,第413篇評論找不到，得用RAWDATA回溯
,414,5,,第414篇評論找不到，得用RAWDATA回溯
,415,4,,第415篇評論找不到，得用RAWDATA回溯
,416,4,,第416篇評論找不到，得用RAWDATA回溯
,417,5,,第417篇評論找不到，得用RAWDATA回溯
,418,5,,第418篇評論找不到，得用RAWDATA回溯
,419,5,,第419篇評論找不到，得用RAWDATA回溯
,420,5,,第420篇評論找不到，得用RAWDATA回溯
,421,5,,第421篇評論找不到，得用RAWDATA回溯
,422,5,,第422篇評論找不到，得用RAWDATA回溯
,423,5,,第423篇評論找不到，得用RAWDATA回溯
,424,3,,第424篇評論找不到，得用RAWDATA回溯
,425,4,,第425篇評論找不到，得用RAWDATA回溯
,426,5,,很棒 小姐很認真帶解說有學到相對應知識很推薦親子共遊學校校校外教學的好去處
,427,5,,第427篇評論找不到，得用RAWDATA回溯
,428,4,,第428篇評論找不到，得用RAWDATA回溯
,429,3,,第429篇評論找不到，得用RAWDATA回溯
,430,2,,第430篇評論找不到，得用RAWDATA回溯
,431,5,,第431篇評論找不到，得用RAWDATA回溯
,432,5,,第432篇評論找不到，得用RAWDATA回溯
,433,5,,第433篇評論找不到，得用RAWDATA回溯
,434,5,,第434篇評論找不到，得用RAWDATA回溯
,435,5,,第435篇評論找不到，得用RAWDATA回溯
,436,3,,第436篇評論找不到，得用RAWDATA回溯
,437,5,,第437篇評論找不到，得用RAWDATA回溯
,438,5,,第438篇評論找不到，得用RAWDATA回溯
,439,2,,第439篇評論找不到，得用RAWDATA回溯
,440,5,,第440篇評論找不到，得用RAWDATA回溯
,441,5,,第441篇評論找不到，得用RAWDATA回溯
,442,3,,第442篇評論找不到，得用RAWDATA回溯
,443,5,,第443篇評論找不到，得用RAWDATA回溯
,444,5,,第444篇評論找不到，得用RAWDATA回溯
,445,1,,第445篇評論找不到，得用RAWDATA回溯
,446,5,,第446篇評論找不到，得用RAWDATA回溯
,447,5,,第447篇評論找不到，得用RAWDATA回溯
,448,5,,第448篇評論找不到，得用RAWDATA回溯
,449,5,,第449篇評論找不到，得用RAWDATA回溯
,450,5,,第450篇評論找不到，得用RAWDATA回溯
,451,3,,第451篇評論找不到，得用RAWDATA回溯
,452,3,,第452篇評論找不到，得用RAWDATA回溯
,453,5,,第453篇評論找不到，得用RAWDATA回溯
,454,5,,第454篇評論找不到，得用RAWDATA回溯
,455,4,,第455篇評論找不到，得用RAWDATA回溯
,456,5,,第456篇評論找不到，得用RAWDATA回溯
,457,3,,第457篇評論找不到，得用RAWDATA回溯
,458,5,,第458篇評論找不到，得用RAWDATA回溯
,459,5,,第459篇評論找不到，得用RAWDATA回溯
,460,5,,🌟2018年寒假指標#全世界唯一指尖陀螺館，準備玩瘋吧😂🥌世界最大及最小的陀螺都在這，1/19正式試營運（200元）...#世界第一間 #指尖陀螺主題館 #2018新景點#世界最大指尖陀螺 #TOTOLO #陀陀螺
,461,5,,第461篇評論找不到，得用RAWDATA回溯
,462,5,,第462篇評論找不到，得用RAWDATA回溯
,463,4,,第463篇評論找不到，得用RAWDATA回溯
,464,4,,第464篇評論找不到，得用RAWDATA回溯
,465,5,,第465篇評論找不到，得用RAWDATA回溯
,466,5,,第466篇評論找不到，得用RAWDATA回溯
,467,5,,第467篇評論找不到，得用RAWDATA回溯
,468,5,,第468篇評論找不到，得用RAWDATA回溯
,469,5,,第469篇評論找不到，得用RAWDATA回溯
,470,5,,第470篇評論找不到，得用RAWDATA回溯
,471,5,,第471篇評論找不到，得用RAWDATA回溯
,472,5,,第472篇評論找不到，得用RAWDATA回溯
,473,5,,第473篇評論找不到，得用RAWDATA回溯
,474,5,,第474篇評論找不到，得用RAWDATA回溯
,475,5,,第475篇評論找不到，得用RAWDATA回溯
,476,5,,第476篇評論找不到，得用RAWDATA回溯
,477,5,,第477篇評論找不到，得用RAWDATA回溯
,478,5,,第478篇評論找不到，得用RAWDATA回溯
,479,5,,第479篇評論找不到，得用RAWDATA回溯
,480,4,,第480篇評論找不到，得用RAWDATA回溯
,481,5,,第481篇評論找不到，得用RAWDATA回溯
,482,4,,第482篇評論找不到，得用RAWDATA回溯
,483,5,,第483篇評論找不到，得用RAWDATA回溯
,484,5,,第484篇評論找不到，得用RAWDATA回溯
,485,5,,第485篇評論找不到，得用RAWDATA回溯
,486,5,,第486篇評論找不到，得用RAWDATA回溯
,487,5,,第487篇評論找不到，得用RAWDATA回溯
,488,5,,第488篇評論找不到，得用RAWDATA回溯
,489,5,,第489篇評論找不到，得用RAWDATA回溯
,490,5,,第490篇評論找不到，得用RAWDATA回溯
,491,5,,第491篇評論找不到，得用RAWDATA回溯
,492,5,,第492篇評論找不到，得用RAWDATA回溯
,493,5,,第493篇評論找不到，得用RAWDATA回溯
,494,5,,第494篇評論找不到，得用RAWDATA回溯
,495,4,,第495篇評論找不到，得用RAWDATA回溯
,496,3,,陀螺的講解得很好適合大孩子來門票200 空間不大 折抵50
,497,3,,第497篇評論找不到，得用RAWDATA回溯
,498,5,,第498篇評論找不到，得用RAWDATA回溯
,499,5,,第499篇評論找不到，得用RAWDATA回溯
,500,5,,第500篇評論找不到，得用RAWDATA回溯
,501,4,,第501篇評論找不到，得用RAWDATA回溯
,502,5,,第502篇評論找不到，得用RAWDATA回溯
,503,5,,第503篇評論找不到，得用RAWDATA回溯
,504,5,,第504篇評論找不到，得用RAWDATA回溯
,505,3,,第505篇評論找不到，得用RAWDATA回溯
,506,5,,第506篇評論找不到，得用RAWDATA回溯
,507,3,,第507篇評論找不到，得用RAWDATA回溯
,508,5,,第508篇評論找不到，得用RAWDATA回溯
,509,5,,第509篇評論找不到，得用RAWDATA回溯
,510,2,,第510篇評論找不到，得用RAWDATA回溯
,511,3,,第511篇評論找不到，得用RAWDATA回溯
,512,4,,第512篇評論找不到，得用RAWDATA回溯
,513,5,,第513篇評論找不到，得用RAWDATA回溯
,514,4,,第514篇評論找不到，得用RAWDATA回溯
,515,5,,第515篇評論找不到，得用RAWDATA回溯
,516,5,,第516篇評論找不到，得用RAWDATA回溯
,517,5,,第517篇評論找不到，得用RAWDATA回溯
,518,5,,第518篇評論找不到，得用RAWDATA回溯
,519,3,,第519篇評論找不到，得用RAWDATA回溯
,520,5,,第520篇評論找不到，得用RAWDATA回溯
,521,5,,第521篇評論找不到，得用RAWDATA回溯
,522,1,,第522篇評論找不到，得用RAWDATA回溯
,523,5,,第523篇評論找不到，得用RAWDATA回溯
,524,5,,第524篇評論找不到，得用RAWDATA回溯
,525,5,,第525篇評論找不到，得用RAWDATA回溯
,526,3,,第526篇評論找不到，得用RAWDATA回溯
,527,3,,第527篇評論找不到，得用RAWDATA回溯
,528,5,,第528篇評論找不到，得用RAWDATA回溯
,529,5,,第529篇評論找不到，得用RAWDATA回溯
,530,4,,第530篇評論找不到，得用RAWDATA回溯
,531,2,,第531篇評論找不到，得用RAWDATA回溯
,532,5,,第532篇評論找不到，得用RAWDATA回溯
,533,5,,第533篇評論找不到，得用RAWDATA回溯
,534,5,,第534篇評論找不到，得用RAWDATA回溯
,535,4,,第535篇評論找不到，得用RAWDATA回溯
,536,5,,第536篇評論找不到，得用RAWDATA回溯
,537,5,,第537篇評論找不到，得用RAWDATA回溯
,538,5,,第538篇評論找不到，得用RAWDATA回溯
,539,5,,第539篇評論找不到，得用RAWDATA回溯
,540,5,,第540篇評論找不到，得用RAWDATA回溯
,541,4,,第541篇評論找不到，得用RAWDATA回溯
,542,5,,第542篇評論找不到，得用RAWDATA回溯
,543,4,,第543篇評論找不到，得用RAWDATA回溯
,544,5,,第544篇評論找不到，得用RAWDATA回溯
,545,5,,第545篇評論找不到，得用RAWDATA回溯
