_id,sid_comment,star,time,comment
,333,4,,第333篇評論找不到，得用RAWDATA回溯
,334,5,,第334篇評論找不到，得用RAWDATA回溯
,335,4,,第335篇評論找不到，得用RAWDATA回溯
,336,4,,第336篇評論找不到，得用RAWDATA回溯
,337,3,,第337篇評論找不到，得用RAWDATA回溯
,338,3,,第338篇評論找不到，得用RAWDATA回溯
,339,5,,第339篇評論找不到，得用RAWDATA回溯
,340,5,,第340篇評論找不到，得用RAWDATA回溯
,341,3,,第341篇評論找不到，得用RAWDATA回溯
,342,5,,第342篇評論找不到，得用RAWDATA回溯
,343,4,,第343篇評論找不到，得用RAWDATA回溯
,344,4,,第344篇評論找不到，得用RAWDATA回溯
,345,4,,第345篇評論找不到，得用RAWDATA回溯
,346,2,,第346篇評論找不到，得用RAWDATA回溯
,347,4,,第347篇評論找不到，得用RAWDATA回溯
,348,5,,第348篇評論找不到，得用RAWDATA回溯
,349,3,,第349篇評論找不到，得用RAWDATA回溯
,350,4,,第350篇評論找不到，得用RAWDATA回溯
,351,4,,第351篇評論找不到，得用RAWDATA回溯
,352,4,,第352篇評論找不到，得用RAWDATA回溯
,353,3,,第353篇評論找不到，得用RAWDATA回溯
,354,5,,第354篇評論找不到，得用RAWDATA回溯
,355,3,,第355篇評論找不到，得用RAWDATA回溯
,356,5,,第356篇評論找不到，得用RAWDATA回溯
,357,5,,第357篇評論找不到，得用RAWDATA回溯
,358,3,,第358篇評論找不到，得用RAWDATA回溯
,359,4,,第359篇評論找不到，得用RAWDATA回溯
,360,1,,第360篇評論找不到，得用RAWDATA回溯
,361,4,,第361篇評論找不到，得用RAWDATA回溯
,362,1,,第362篇評論找不到，得用RAWDATA回溯
,363,3,,第363篇評論找不到，得用RAWDATA回溯
,364,3,,第364篇評論找不到，得用RAWDATA回溯
,365,4,,第365篇評論找不到，得用RAWDATA回溯
,366,4,,第366篇評論找不到，得用RAWDATA回溯
,367,4,,第367篇評論找不到，得用RAWDATA回溯
,368,4,,第368篇評論找不到，得用RAWDATA回溯
,369,4,,第369篇評論找不到，得用RAWDATA回溯
,370,4,,第370篇評論找不到，得用RAWDATA回溯
,371,4,,第371篇評論找不到，得用RAWDATA回溯
,372,4,,第372篇評論找不到，得用RAWDATA回溯
,373,4,,第373篇評論找不到，得用RAWDATA回溯
,374,3,,第374篇評論找不到，得用RAWDATA回溯
,375,4,,第375篇評論找不到，得用RAWDATA回溯
,376,5,,第376篇評論找不到，得用RAWDATA回溯
,377,4,,第377篇評論找不到，得用RAWDATA回溯
,378,5,,第378篇評論找不到，得用RAWDATA回溯
,379,5,,第379篇評論找不到，得用RAWDATA回溯
,380,5,,第380篇評論找不到，得用RAWDATA回溯
,381,4,,第381篇評論找不到，得用RAWDATA回溯
,382,5,,第382篇評論找不到，得用RAWDATA回溯
,383,4,,第383篇評論找不到，得用RAWDATA回溯
,384,4,,第384篇評論找不到，得用RAWDATA回溯
,385,2,,第385篇評論找不到，得用RAWDATA回溯
,386,4,,第386篇評論找不到，得用RAWDATA回溯
,387,4,,第387篇評論找不到，得用RAWDATA回溯
,388,4,,第388篇評論找不到，得用RAWDATA回溯
,389,5,,第389篇評論找不到，得用RAWDATA回溯
,390,5,,第390篇評論找不到，得用RAWDATA回溯
,391,5,,第391篇評論找不到，得用RAWDATA回溯
,392,4,,第392篇評論找不到，得用RAWDATA回溯
,393,3,,第393篇評論找不到，得用RAWDATA回溯
,394,5,,第394篇評論找不到，得用RAWDATA回溯
,395,5,,第395篇評論找不到，得用RAWDATA回溯
,396,4,,第396篇評論找不到，得用RAWDATA回溯
,397,3,,第397篇評論找不到，得用RAWDATA回溯
,398,5,,第398篇評論找不到，得用RAWDATA回溯
,399,4,,第399篇評論找不到，得用RAWDATA回溯
,400,4,,第400篇評論找不到，得用RAWDATA回溯
,401,1,,第401篇評論找不到，得用RAWDATA回溯
,402,3,,第402篇評論找不到，得用RAWDATA回溯
,403,3,,第403篇評論找不到，得用RAWDATA回溯
,404,4,,第404篇評論找不到，得用RAWDATA回溯
,405,3,,第405篇評論找不到，得用RAWDATA回溯
,406,4,,第406篇評論找不到，得用RAWDATA回溯
,407,2,,第407篇評論找不到，得用RAWDATA回溯
,408,3,,第408篇評論找不到，得用RAWDATA回溯
,409,4,,第409篇評論找不到，得用RAWDATA回溯
,410,4,,第410篇評論找不到，得用RAWDATA回溯
,411,5,,第411篇評論找不到，得用RAWDATA回溯
,412,5,,第412篇評論找不到，得用RAWDATA回溯
,413,4,,第413篇評論找不到，得用RAWDATA回溯
,414,3,,第414篇評論找不到，得用RAWDATA回溯
,415,5,,第415篇評論找不到，得用RAWDATA回溯
,416,4,,第416篇評論找不到，得用RAWDATA回溯
,417,5,,第417篇評論找不到，得用RAWDATA回溯
,418,4,,第418篇評論找不到，得用RAWDATA回溯
,419,4,,第419篇評論找不到，得用RAWDATA回溯
,420,5,,第420篇評論找不到，得用RAWDATA回溯
,421,5,,第421篇評論找不到，得用RAWDATA回溯
,422,4,,第422篇評論找不到，得用RAWDATA回溯
,423,5,,第423篇評論找不到，得用RAWDATA回溯
,424,4,,第424篇評論找不到，得用RAWDATA回溯
,425,3,,第425篇評論找不到，得用RAWDATA回溯
,426,5,,第426篇評論找不到，得用RAWDATA回溯
,427,5,,第427篇評論找不到，得用RAWDATA回溯
,428,4,,第428篇評論找不到，得用RAWDATA回溯
,429,5,,第429篇評論找不到，得用RAWDATA回溯
,430,4,,第430篇評論找不到，得用RAWDATA回溯
,431,4,,第431篇評論找不到，得用RAWDATA回溯
,432,4,,第432篇評論找不到，得用RAWDATA回溯
,433,3,,第433篇評論找不到，得用RAWDATA回溯
,434,5,,第434篇評論找不到，得用RAWDATA回溯
,435,5,,第435篇評論找不到，得用RAWDATA回溯
,436,1,,第436篇評論找不到，得用RAWDATA回溯
,437,5,,第437篇評論找不到，得用RAWDATA回溯
,438,2,,第438篇評論找不到，得用RAWDATA回溯
,439,4,,第439篇評論找不到，得用RAWDATA回溯
,440,5,,第440篇評論找不到，得用RAWDATA回溯
,441,4,,第441篇評論找不到，得用RAWDATA回溯
,442,4,,第442篇評論找不到，得用RAWDATA回溯
,443,5,,第443篇評論找不到，得用RAWDATA回溯
,444,5,,第444篇評論找不到，得用RAWDATA回溯
,445,5,,第445篇評論找不到，得用RAWDATA回溯
,446,5,,第446篇評論找不到，得用RAWDATA回溯
,447,3,,第447篇評論找不到，得用RAWDATA回溯
,448,4,,第448篇評論找不到，得用RAWDATA回溯
,449,4,,第449篇評論找不到，得用RAWDATA回溯
,450,1,,第450篇評論找不到，得用RAWDATA回溯
,451,3,,第451篇評論找不到，得用RAWDATA回溯
,452,5,,第452篇評論找不到，得用RAWDATA回溯
,453,4,,第453篇評論找不到，得用RAWDATA回溯
,454,5,,第454篇評論找不到，得用RAWDATA回溯
,455,5,,第455篇評論找不到，得用RAWDATA回溯
,456,4,,第456篇評論找不到，得用RAWDATA回溯
,457,1,,第457篇評論找不到，得用RAWDATA回溯
,458,3,,第458篇評論找不到，得用RAWDATA回溯
,459,3,,第459篇評論找不到，得用RAWDATA回溯
,460,4,,第460篇評論找不到，得用RAWDATA回溯
,461,2,,第461篇評論找不到，得用RAWDATA回溯
,462,1,,第462篇評論找不到，得用RAWDATA回溯
,463,4,,第463篇評論找不到，得用RAWDATA回溯
,464,5,,第464篇評論找不到，得用RAWDATA回溯
,465,4,,第465篇評論找不到，得用RAWDATA回溯
,466,4,,第466篇評論找不到，得用RAWDATA回溯
,467,3,,第467篇評論找不到，得用RAWDATA回溯
,468,5,,第468篇評論找不到，得用RAWDATA回溯
,469,5,,第469篇評論找不到，得用RAWDATA回溯
,470,1,,第470篇評論找不到，得用RAWDATA回溯
,471,3,,第471篇評論找不到，得用RAWDATA回溯
,472,5,,第472篇評論找不到，得用RAWDATA回溯
,473,5,,第473篇評論找不到，得用RAWDATA回溯
,474,4,,第474篇評論找不到，得用RAWDATA回溯
,475,3,,第475篇評論找不到，得用RAWDATA回溯
,476,5,,第476篇評論找不到，得用RAWDATA回溯
,477,5,,第477篇評論找不到，得用RAWDATA回溯
,478,4,,第478篇評論找不到，得用RAWDATA回溯
,479,3,,第479篇評論找不到，得用RAWDATA回溯
,480,4,,第480篇評論找不到，得用RAWDATA回溯
,481,5,,第481篇評論找不到，得用RAWDATA回溯
,482,5,,第482篇評論找不到，得用RAWDATA回溯
,483,3,,第483篇評論找不到，得用RAWDATA回溯
,484,4,,第484篇評論找不到，得用RAWDATA回溯
,485,5,,第485篇評論找不到，得用RAWDATA回溯
,486,1,,第486篇評論找不到，得用RAWDATA回溯
,487,5,,第487篇評論找不到，得用RAWDATA回溯
,488,5,,第488篇評論找不到，得用RAWDATA回溯
,489,3,,第489篇評論找不到，得用RAWDATA回溯
,490,4,,第490篇評論找不到，得用RAWDATA回溯
,491,5,,第491篇評論找不到，得用RAWDATA回溯
,492,3,,第492篇評論找不到，得用RAWDATA回溯
,493,3,,第493篇評論找不到，得用RAWDATA回溯
,494,3,,第494篇評論找不到，得用RAWDATA回溯
,495,3,,第495篇評論找不到，得用RAWDATA回溯
,496,3,,第496篇評論找不到，得用RAWDATA回溯
,497,5,,第497篇評論找不到，得用RAWDATA回溯
,498,5,,第498篇評論找不到，得用RAWDATA回溯
,499,5,,第499篇評論找不到，得用RAWDATA回溯
,500,5,,第500篇評論找不到，得用RAWDATA回溯
,501,4,,第501篇評論找不到，得用RAWDATA回溯
,502,4,,第502篇評論找不到，得用RAWDATA回溯
,503,3,,第503篇評論找不到，得用RAWDATA回溯
,504,4,,第504篇評論找不到，得用RAWDATA回溯
,505,4,,第505篇評論找不到，得用RAWDATA回溯
,506,5,,第506篇評論找不到，得用RAWDATA回溯
,507,4,,第507篇評論找不到，得用RAWDATA回溯
,508,4,,第508篇評論找不到，得用RAWDATA回溯
,509,5,,第509篇評論找不到，得用RAWDATA回溯
,510,3,,第510篇評論找不到，得用RAWDATA回溯
,511,3,,第511篇評論找不到，得用RAWDATA回溯
,512,3,,第512篇評論找不到，得用RAWDATA回溯
,513,5,,"(由 Google 提供翻譯) 一開始我並不真正了解，只是在我進行巡演時，我只是驚訝地發現這是一家醋工廠（或簡稱為醋）。有趣的是，除了生產各種口味的醋外，我覺得直接感覺也很有趣。許氏的傳奇工廠還生產與SKII相當的化妝品。不幸的是，這些產品的英文信息很難找到。(原始評論)Gw kurang paham bener awalnya, pas ikut tour-nya baru rada ngeh kalau ini pabrik vinegar (atau simpelnya cuka ajah).Yang menarik, selain menghasilkan vinegar dalam beragam rasa yg menurut gw menyenangkan untuk langsung dirasakan.Hsu's Legend Factory ini juga menghasilkan kosmetik yang diklaim setara SKII.Sayang informasi soal produk-produk i ni dalam bahasa Inggris agak sulit ditemui."
,514,5,,第514篇評論找不到，得用RAWDATA回溯
,515,5,,"(由 Google 提供翻譯) 一個有趣的地方，你可以看到並獲得有關醋加工產品的一些信息......最令人興奮的，你也可以品嚐和嘗試產品。 💃🤓(原始評論)Tempat yang cukup menarik untuk dikunjungi, kamu bisa melihat dan memdapatkan beberapa informasi tentang produk pengolahan cuka .. Dan yang paling mrnyrnangkan , kamu juga dapat mencicipi dan mencoba produknya . 💃🤓"
,516,5,,(由 Google 提供翻譯) 這是一個有趣的地方，非常適合想要了解台灣文化產品並最喜歡走出台北繁華街道的人們。這種先進的設施為兒童玩耍和成年人購物提供了充足的空間。我們覺得從這裡可以學到很多東西，並且還可以為我們的家人買到一些禮物。(原始評論)This is an interesting place perfect for people that want to understand Taiwanese cultural products and best yet enjoy getting out of the busy streets of Taipei. This state of the art facility offers ample space for children to play and adults to shop. We felt that we learned a great deal from going here and was also able to pick up some gifts for our family back home.
,517,1,,(由 Google 提供翻譯) 這是一家生產水果醋，米燒酒和葡萄酒的工廠和商店。有一家簡單的餐廳，但不提供酒精飲料。當地的出租車司機甚至都不知道我們在哪裡，所以我們很難到達這裡。從宜蘭火車站乘坐出租車到酒店的費用為210美元。在返回途中，到礁溪站的費用為250美元。我試過品嚐紅酒，但令我驚訝的是它的廉價味道，例如將葡萄汁加入酒精中。(原始評論)果物酢や米焼酎、ワインの工場兼ショップです。かんたんなレストランがありますが、アルコール類は出していません。地元のタクシーの運転手も当地を知らないので、この場所に到着するまでに苦労しました。宜蘭駅からタクシーで210ドルの料金でした。帰りは礁溪駅までで250ドルの料金でした。赤ワインを試飲しましたが、葡萄ジュースにアルコールを足したようなチープな味でびっくりしました。
,518,4,,第518篇評論找不到，得用RAWDATA回溯
,519,4,,第519篇評論找不到，得用RAWDATA回溯
,520,5,,第520篇評論找不到，得用RAWDATA回溯
,521,4,,"(由 Google 提供翻譯) 很棒的室內2層兒童滑梯，但不適合大人。(原始評論)Awesome indoor 2-story slide for kids,but not for grown ups."
,522,4,,第522篇評論找不到，得用RAWDATA回溯
,523,4,,第523篇評論找不到，得用RAWDATA回溯
,524,5,,第524篇評論找不到，得用RAWDATA回溯
,525,5,,第525篇評論找不到，得用RAWDATA回溯
,526,4,,第526篇評論找不到，得用RAWDATA回溯
,527,4,,第527篇評論找不到，得用RAWDATA回溯
,528,4,,第528篇評論找不到，得用RAWDATA回溯
,529,4,,第529篇評論找不到，得用RAWDATA回溯
,530,4,,第530篇評論找不到，得用RAWDATA回溯
,531,5,,第531篇評論找不到，得用RAWDATA回溯
,532,4,,第532篇評論找不到，得用RAWDATA回溯
,533,4,,第533篇評論找不到，得用RAWDATA回溯
,534,5,,第534篇評論找不到，得用RAWDATA回溯
,535,5,,第535篇評論找不到，得用RAWDATA回溯
,536,4,,第536篇評論找不到，得用RAWDATA回溯
,537,4,,第537篇評論找不到，得用RAWDATA回溯
,538,5,,第538篇評論找不到，得用RAWDATA回溯
,539,5,,第539篇評論找不到，得用RAWDATA回溯
,540,5,,第540篇評論找不到，得用RAWDATA回溯
,541,5,,第541篇評論找不到，得用RAWDATA回溯
,542,4,,第542篇評論找不到，得用RAWDATA回溯
,543,5,,第543篇評論找不到，得用RAWDATA回溯
,544,4,,第544篇評論找不到，得用RAWDATA回溯
,545,5,,第545篇評論找不到，得用RAWDATA回溯
,546,5,,第546篇評論找不到，得用RAWDATA回溯
,547,4,,第547篇評論找不到，得用RAWDATA回溯
,548,5,,第548篇評論找不到，得用RAWDATA回溯
,549,4,,第549篇評論找不到，得用RAWDATA回溯
,550,3,,第550篇評論找不到，得用RAWDATA回溯
,551,5,,第551篇評論找不到，得用RAWDATA回溯
,552,5,,第552篇評論找不到，得用RAWDATA回溯
,553,4,,第553篇評論找不到，得用RAWDATA回溯
,554,5,,第554篇評論找不到，得用RAWDATA回溯
,555,5,,第555篇評論找不到，得用RAWDATA回溯
,556,5,,第556篇評論找不到，得用RAWDATA回溯
,557,4,,第557篇評論找不到，得用RAWDATA回溯
,558,5,,第558篇評論找不到，得用RAWDATA回溯
,559,5,,第559篇評論找不到，得用RAWDATA回溯
,560,4,,第560篇評論找不到，得用RAWDATA回溯
,561,5,,第561篇評論找不到，得用RAWDATA回溯
,562,4,,第562篇評論找不到，得用RAWDATA回溯
,563,3,,第563篇評論找不到，得用RAWDATA回溯
,564,3,,第564篇評論找不到，得用RAWDATA回溯
,565,4,,第565篇評論找不到，得用RAWDATA回溯
,566,3,,第566篇評論找不到，得用RAWDATA回溯
,567,3,,第567篇評論找不到，得用RAWDATA回溯
,568,3,,第568篇評論找不到，得用RAWDATA回溯
,569,3,,第569篇評論找不到，得用RAWDATA回溯
,570,5,,第570篇評論找不到，得用RAWDATA回溯
,571,4,,第571篇評論找不到，得用RAWDATA回溯
,572,5,,第572篇評論找不到，得用RAWDATA回溯
,573,5,,第573篇評論找不到，得用RAWDATA回溯
,574,5,,第574篇評論找不到，得用RAWDATA回溯
,575,2,,第575篇評論找不到，得用RAWDATA回溯
,576,4,,第576篇評論找不到，得用RAWDATA回溯
,577,4,,第577篇評論找不到，得用RAWDATA回溯
,578,4,,第578篇評論找不到，得用RAWDATA回溯
,579,5,,第579篇評論找不到，得用RAWDATA回溯
,580,4,,第580篇評論找不到，得用RAWDATA回溯
,581,5,,第581篇評論找不到，得用RAWDATA回溯
,582,4,,第582篇評論找不到，得用RAWDATA回溯
,583,1,,第583篇評論找不到，得用RAWDATA回溯
,584,4,,第584篇評論找不到，得用RAWDATA回溯
,585,4,,第585篇評論找不到，得用RAWDATA回溯
,586,4,,第586篇評論找不到，得用RAWDATA回溯
,587,4,,第587篇評論找不到，得用RAWDATA回溯
,588,5,,第588篇評論找不到，得用RAWDATA回溯
,589,5,,第589篇評論找不到，得用RAWDATA回溯
,590,3,,第590篇評論找不到，得用RAWDATA回溯
,591,5,,第591篇評論找不到，得用RAWDATA回溯
,592,5,,第592篇評論找不到，得用RAWDATA回溯
,593,5,,第593篇評論找不到，得用RAWDATA回溯
,594,4,,第594篇評論找不到，得用RAWDATA回溯
,595,5,,第595篇評論找不到，得用RAWDATA回溯
,596,5,,第596篇評論找不到，得用RAWDATA回溯
,597,4,,第597篇評論找不到，得用RAWDATA回溯
,598,5,,第598篇評論找不到，得用RAWDATA回溯
,599,4,,第599篇評論找不到，得用RAWDATA回溯
,600,1,,第600篇評論找不到，得用RAWDATA回溯
,601,4,,第601篇評論找不到，得用RAWDATA回溯
,602,5,,第602篇評論找不到，得用RAWDATA回溯
,603,4,,第603篇評論找不到，得用RAWDATA回溯
,604,4,,第604篇評論找不到，得用RAWDATA回溯
,605,5,,第605篇評論找不到，得用RAWDATA回溯
,606,4,,第606篇評論找不到，得用RAWDATA回溯
,607,4,,第607篇評論找不到，得用RAWDATA回溯
,608,4,,第608篇評論找不到，得用RAWDATA回溯
,609,5,,第609篇評論找不到，得用RAWDATA回溯
,610,1,,第610篇評論找不到，得用RAWDATA回溯
,611,4,,第611篇評論找不到，得用RAWDATA回溯
,612,4,,第612篇評論找不到，得用RAWDATA回溯
,613,4,,第613篇評論找不到，得用RAWDATA回溯
,614,3,,第614篇評論找不到，得用RAWDATA回溯
,615,5,,第615篇評論找不到，得用RAWDATA回溯
,616,5,,第616篇評論找不到，得用RAWDATA回溯
,617,5,,第617篇評論找不到，得用RAWDATA回溯
,618,4,,第618篇評論找不到，得用RAWDATA回溯
,619,3,,第619篇評論找不到，得用RAWDATA回溯
,620,4,,第620篇評論找不到，得用RAWDATA回溯
,621,4,,第621篇評論找不到，得用RAWDATA回溯
,622,4,,第622篇評論找不到，得用RAWDATA回溯
,623,3,,第623篇評論找不到，得用RAWDATA回溯
,624,5,,第624篇評論找不到，得用RAWDATA回溯
,625,3,,第625篇評論找不到，得用RAWDATA回溯
,626,5,,第626篇評論找不到，得用RAWDATA回溯
,627,5,,第627篇評論找不到，得用RAWDATA回溯
,628,5,,第628篇評論找不到，得用RAWDATA回溯
,629,4,,第629篇評論找不到，得用RAWDATA回溯
,630,5,,第630篇評論找不到，得用RAWDATA回溯
,631,5,,第631篇評論找不到，得用RAWDATA回溯
,632,3,,第632篇評論找不到，得用RAWDATA回溯
,633,4,,第633篇評論找不到，得用RAWDATA回溯
,634,3,,第634篇評論找不到，得用RAWDATA回溯
,635,4,,第635篇評論找不到，得用RAWDATA回溯
,636,4,,第636篇評論找不到，得用RAWDATA回溯
,637,5,,第637篇評論找不到，得用RAWDATA回溯
,638,5,,第638篇評論找不到，得用RAWDATA回溯
,639,3,,第639篇評論找不到，得用RAWDATA回溯
,640,5,,第640篇評論找不到，得用RAWDATA回溯
,641,3,,第641篇評論找不到，得用RAWDATA回溯
,642,5,,第642篇評論找不到，得用RAWDATA回溯
,643,4,,第643篇評論找不到，得用RAWDATA回溯
,644,4,,第644篇評論找不到，得用RAWDATA回溯
,645,4,,第645篇評論找不到，得用RAWDATA回溯
,646,5,,第646篇評論找不到，得用RAWDATA回溯
,647,4,,第647篇評論找不到，得用RAWDATA回溯
,648,2,,第648篇評論找不到，得用RAWDATA回溯
,649,4,,第649篇評論找不到，得用RAWDATA回溯
,650,3,,第650篇評論找不到，得用RAWDATA回溯
,651,3,,第651篇評論找不到，得用RAWDATA回溯
,652,4,,第652篇評論找不到，得用RAWDATA回溯
,653,4,,第653篇評論找不到，得用RAWDATA回溯
,654,3,,第654篇評論找不到，得用RAWDATA回溯
,655,5,,第655篇評論找不到，得用RAWDATA回溯
,656,3,,第656篇評論找不到，得用RAWDATA回溯
,657,4,,第657篇評論找不到，得用RAWDATA回溯
,658,3,,第658篇評論找不到，得用RAWDATA回溯
,659,5,,第659篇評論找不到，得用RAWDATA回溯
,660,4,,第660篇評論找不到，得用RAWDATA回溯
,661,5,,第661篇評論找不到，得用RAWDATA回溯
,662,3,,第662篇評論找不到，得用RAWDATA回溯
,663,3,,第663篇評論找不到，得用RAWDATA回溯
,664,5,,第664篇評論找不到，得用RAWDATA回溯
,665,4,,第665篇評論找不到，得用RAWDATA回溯
,666,4,,第666篇評論找不到，得用RAWDATA回溯
,667,4,,第667篇評論找不到，得用RAWDATA回溯
,668,4,,第668篇評論找不到，得用RAWDATA回溯
,669,5,,第669篇評論找不到，得用RAWDATA回溯
,670,4,,第670篇評論找不到，得用RAWDATA回溯
,671,4,,第671篇評論找不到，得用RAWDATA回溯
,672,4,,第672篇評論找不到，得用RAWDATA回溯
,673,4,,第673篇評論找不到，得用RAWDATA回溯
,674,5,,第674篇評論找不到，得用RAWDATA回溯
,675,5,,第675篇評論找不到，得用RAWDATA回溯
,676,5,,第676篇評論找不到，得用RAWDATA回溯
,677,3,,第677篇評論找不到，得用RAWDATA回溯
,678,5,,第678篇評論找不到，得用RAWDATA回溯
,679,4,,第679篇評論找不到，得用RAWDATA回溯
,680,5,,第680篇評論找不到，得用RAWDATA回溯
,681,4,,第681篇評論找不到，得用RAWDATA回溯
,682,3,,第682篇評論找不到，得用RAWDATA回溯
,683,3,,第683篇評論找不到，得用RAWDATA回溯
,684,3,,第684篇評論找不到，得用RAWDATA回溯
,685,4,,第685篇評論找不到，得用RAWDATA回溯
,686,5,,第686篇評論找不到，得用RAWDATA回溯
,687,3,,第687篇評論找不到，得用RAWDATA回溯
,688,5,,第688篇評論找不到，得用RAWDATA回溯
,689,5,,第689篇評論找不到，得用RAWDATA回溯
,690,2,,第690篇評論找不到，得用RAWDATA回溯
,691,4,,第691篇評論找不到，得用RAWDATA回溯
,692,5,,第692篇評論找不到，得用RAWDATA回溯
,693,5,,第693篇評論找不到，得用RAWDATA回溯
,694,5,,第694篇評論找不到，得用RAWDATA回溯
,695,3,,第695篇評論找不到，得用RAWDATA回溯
,696,4,,第696篇評論找不到，得用RAWDATA回溯
,697,4,,第697篇評論找不到，得用RAWDATA回溯
,698,3,,第698篇評論找不到，得用RAWDATA回溯
,699,4,,第699篇評論找不到，得用RAWDATA回溯
,700,5,,第700篇評論找不到，得用RAWDATA回溯
,701,5,,第701篇評論找不到，得用RAWDATA回溯
,702,4,,第702篇評論找不到，得用RAWDATA回溯
,703,2,,第703篇評論找不到，得用RAWDATA回溯
,704,4,,第704篇評論找不到，得用RAWDATA回溯
,705,4,,第705篇評論找不到，得用RAWDATA回溯
,706,4,,第706篇評論找不到，得用RAWDATA回溯
,707,4,,第707篇評論找不到，得用RAWDATA回溯
,708,3,,第708篇評論找不到，得用RAWDATA回溯
,709,5,,第709篇評論找不到，得用RAWDATA回溯
,710,5,,第710篇評論找不到，得用RAWDATA回溯
,711,2,,第711篇評論找不到，得用RAWDATA回溯
,712,5,,第712篇評論找不到，得用RAWDATA回溯
,713,4,,第713篇評論找不到，得用RAWDATA回溯
,714,1,,第714篇評論找不到，得用RAWDATA回溯
,715,4,,第715篇評論找不到，得用RAWDATA回溯
,716,4,,第716篇評論找不到，得用RAWDATA回溯
,717,4,,第717篇評論找不到，得用RAWDATA回溯
,718,4,,第718篇評論找不到，得用RAWDATA回溯
,719,5,,第719篇評論找不到，得用RAWDATA回溯
,720,5,,第720篇評論找不到，得用RAWDATA回溯
,721,5,,第721篇評論找不到，得用RAWDATA回溯
,722,5,,第722篇評論找不到，得用RAWDATA回溯
,723,2,,第723篇評論找不到，得用RAWDATA回溯
,724,4,,第724篇評論找不到，得用RAWDATA回溯
,725,2,,第725篇評論找不到，得用RAWDATA回溯
,726,3,,第726篇評論找不到，得用RAWDATA回溯
,727,5,,第727篇評論找不到，得用RAWDATA回溯
,728,3,,第728篇評論找不到，得用RAWDATA回溯
,729,3,,第729篇評論找不到，得用RAWDATA回溯
,730,5,,第730篇評論找不到，得用RAWDATA回溯
,731,4,,第731篇評論找不到，得用RAWDATA回溯
,732,2,,第732篇評論找不到，得用RAWDATA回溯
,733,5,,第733篇評論找不到，得用RAWDATA回溯
,734,4,,第734篇評論找不到，得用RAWDATA回溯
,735,5,,第735篇評論找不到，得用RAWDATA回溯
,736,2,,第736篇評論找不到，得用RAWDATA回溯
,737,4,,第737篇評論找不到，得用RAWDATA回溯
,738,5,,第738篇評論找不到，得用RAWDATA回溯
,739,5,,第739篇評論找不到，得用RAWDATA回溯
,740,4,,第740篇評論找不到，得用RAWDATA回溯
,741,3,,第741篇評論找不到，得用RAWDATA回溯
,742,3,,第742篇評論找不到，得用RAWDATA回溯
,743,4,,第743篇評論找不到，得用RAWDATA回溯
,744,3,,第744篇評論找不到，得用RAWDATA回溯
,745,3,,第745篇評論找不到，得用RAWDATA回溯
,746,4,,第746篇評論找不到，得用RAWDATA回溯
,747,3,,第747篇評論找不到，得用RAWDATA回溯
,748,4,,第748篇評論找不到，得用RAWDATA回溯
,749,4,,第749篇評論找不到，得用RAWDATA回溯
,750,5,,第750篇評論找不到，得用RAWDATA回溯
,751,4,,第751篇評論找不到，得用RAWDATA回溯
,752,3,,第752篇評論找不到，得用RAWDATA回溯
